#Org.,Pro.,Eco.,Descripción,,,,,,,O
60,13300,22000,TRAFICO. ORDINARIO NO INVENTARIABLE.,,,,,,,661.18
60,13300,22104,TRAFICO. VESTIARIO.,,,,,,,774.9
60,13300,22106,TRAFICO. PRODUCTOS FARMACÉUTICOS E MATERIAL SANITARIO.,,,,,,,0
60,13300,22199,TRAFICO. OUTROS SUBMINISTROS.,,,,,,,8720.95
60,13300,22699,TRAFICO. OUTROS GASTOS DIVERSOS,,,,,,,3564
60,13300,22701,TRAFICO. SEGURIDADE,,,,,,,736506.65
60,13300,22706,TRAFICO. ESTUDOS E TRABALLOS TÉCNICOS.,,,,,,,6137.97
60,13300,23000,AXUDAS CUSTE DOS MEMBROS ÓRGANOS DE GOBERNO,,,,,,,0
60,13300,23100,LOCOMOCIÓN.DOS MEMBROS ÓRGANOS DO GOBERNO,,,,,,,0
60,13300,62300,"SEGURIDADE E ORDE PÚBLICA. MAQUINARIA, INSTALAC. E UTILLAXE",,,,,,,28833.42
60,13300,62500,MOBILIARIO,,,,,,,3266
60,13500,20400,PROTECCION CIVIL. ARRENDAMENTO MATERIAL DE TRANSPORTE,,,,,,,12584
60,13500,21200,PROTECCION CIVIL.REPARAC. MANTEM. EDIFICIOS E O.CONSTRUC,,,,,,,6092.94
60,13500,22102,PROTECCION CIVIL. GAS.,,,,,,,1901.46
60,13500,22104,PROTECCIÓN CIVIL. VESTIARIO.,,,,,,,16095.42
60,13500,22105,PROTECCION CIVIL. PRODUCTOS ALIMENTICIOS.,,,,,,,7460.79
60,13500,22106,PRODUCTOS FARMACÉUTICOS Y MATERIAL SANITARIO.,,,,,,,0
60,13500,22111,"SUBMIN. DE REPUESTOS DE MAQUINARIA, UTILLAXE E TRANSP",,,,,,,4143.04
60,13500,22400,PROTECCIÓN CIVIL. PRIMAS DE SEGUROS,,,,,,,0
60,13500,22606,"PROTECCIÓN CIVIL.REUNIONS, CONFERENCIAS E CURSOS.",,,,,,,480
60,13500,22701,PROTECCIÓN CIVIL. SEGURIDADE,,,,,,,0
60,13600,20400,BOMBEIROS. ARRENDAMENTO MATERIAL DE TRANSPORTE,,,,,,,0
60,13600,21200,BOMBEIROS. REPARAC. MANTEM. EDIFICIOS E O.CONSTRUC,,,,,,,2444.2
60,13600,21300,"BOMBEIROS. REPARAC. MANTEM, MAQUIN.,INSTA E UTILLA.",,,,,,,6695.28
60,13600,21400,BOMBEIROS. REPARAC. MANTEM. MATERIAL TRANSPORTE,,,,,,,19066.89
60,13600,22000,BOMBEIROS. ORDINARIO NON INVENTARIABLE.,,,,,,,0
60,13600,22001,"BOMBEIROS. PRENSA, REVISTAS, LIBROS E OUTRAS PUBLICACIONS",,,,,,,0
60,13600,22002,BOMBEIROS. MATERIAL INFORMÁTICO NON INVENTARIABLE.,,,,,,,0
60,13600,22104,BOMBEIROS. VESTIARIO.,,,,,,,0
60,13600,22110,BOMBEIROS. PRODUCTOS DE LIMPEZA E ASEO.,,,,,,,0
60,13600,22199,BOMBEIROS. OUTROS SUBMINISTROS,,,,,,,0
60,13600,22607,BOMBEIROS.OPOSICIONS E PROBAS SELECTIVAS,,,,,,,0
60,13600,22699,BOMBEIROS. OUTROS GASTOS DIVERSOS,,,,,,,10162.57
60,13600,23020,BOMBEIROS. AXUDAS DE CUSTE DO PERSOAL NON DIRECTIVO.,,,,,,,0
60,13600,23120,BOMBEIROS. LOCOMOCIÓN DO PERSOAL NON DIRECTIVO.,,,,,,,0
60,13600,62200,EDIFICIOS E OUTRAS CONSTRUCCIONS,,,,,,,0
60,13600,62300,"MAQUINARIA, INSTALACIONS E UTILLAXE",,,,,,,56058.24
60,13600,62500,MOBILIARIO,,,,,,,12072.47
60,13600,63200,BOMBEIROS. INV. REPOSICION EDIFICIOS E CONSTRUCC.,,,,,,,30327.93
60,44110,22602,TRANSPORTES. PUBLICIDADE E PROPAGANDA.,,,,,,,0
60,44110,22699,TRANSPORTES. OUTROS GASTOS DIVERSOS,,,,,,,7242.09
60,44110,22706,TRANSPORTE.ESTUDOS E TRABALLOS TÉCNICOS.,,,,,,,0
60,44110,45000,TRANSPORTES. TRANSFERENCIAS Á COMUNIDADE AUTONOMA,,,,,,,21180.34
60,44110,47900,TRANSPORTES. TRANSFERENCIAS CORRENTES A EMPRESAS PRIVADAS,,,,,,,4383246.99
60,44110,62400,MATERIAL DE TRANSPORTE,,,,,,,0
60,93200,22706,ESTUDIOS Y TRABAJOS TÉCNICOS.,,,,,,,455867.42
70,24100,20300,ARRENDAMENTO MAQUIN. INSTALAC. E UTILL.,,,,,,,2051.19
70,24100,21200,FOMENTO DE EMPREGO. REPARAC. MANTEM. EDIFICIOS E O.CONSTRUC,,,,,,,5159.8
70,24100,21300,"FOMENTO DE EMPREGO. REPARAC. MANTEM, MAQUIN.,INSTA E UTILLA.",,,,,,,162.07
70,24100,21600,FOMENTO DO EMPREGO. REPARA. MANTEN. EQUIPOS PROCESOS INFORM.,,,,,,,531.32
70,24100,22001,"FOMENTO DO EMPREGO. PRENSA, REVISTAS, LIBROS E O. PUBLICACI",,,,,,,7461.89
70,24100,22102,FOMENTO DO EMPREGO. GAS.,,,,,,,1188.74
70,24100,22104,FOMENTO DO EMPREGO. VESTIARIO.,,,,,,,2000.26
70,24100,22400,PRIMAS DE SEGUROS,,,,,,,115.05
70,24100,22602,FOMENTO DO EMPREGO. PUBLICIDADE E PROPAGANDA.,,,,,,,9532.93
70,24100,22606,"FOMENTO DO EMPREGO. REUNIONS, CONFERENCIAS E CURSOS.",,,,,,,376365.31
70,24100,22699,FOMENTO DO EMPREGO. OUTROS GASTOS DIVERSOS,,,,,,,39494.13
70,24100,22701,FOMENTO DO EMPREGO. SEGURIDADE.,,,,,,,3724.74
70,24100,22706,FOMENTO DO EMPREGO. ESTUDIOS E TRABALLOS TÉCNICOS.,,,,,,,123795.88
70,24100,22799,OTROS TRABAJOS REALIZADOS POR OTRAS EMPRESAS Y PROFES.,,,,,,,0
70,24100,47000,EMPREGO. SUBVENCIONES PARA FOMENTO DEL EMPLEO.,,,,,,,1550
70,24100,48900,FOMENTO DO EMPREGO.OUTRAS TRANSFERENCIAS,,,,,,,14792
70,24100,62300,"MAQUINARIA, INSTALACIONS E UTILLAXE",,,,,,,11753.94
70,43100,22699,COMERCIO. OUTROS GASTOS DIVERSOS,,,,,,,211980.53
70,43100,22706,COMERCIO. ESTUDIOS E TRABALLOS TÉCNICOS.,,,,,,,11983.16
70,43100,48900,COMERCIO. OUTRAS TRANSFERENCIAS NOMINATIVAS,,,,,,,0
70,43100,48901,COMERCIO. OUTRAS TRANSFERENCIAS NON NOMINATIVAS,,,,,,,28530.31
70,43100,64100,COMERCIO. GASTOS EN APLICACIÓNS INFORMÁTICAS,,,,,,,9300
70,43100,77000,COMERCIO.TRANSFERENCIAS CAPITAL A EMPRESAS PRIVAD,,,,,,,13653.49
70,43120,21600,MERCADOS. REPARA. MANTEN. EQUIPOS PROCESOS INFORM.,,,,,,,0
70,43120,22699,MERCADOS. OUTROS GASTOS DIVERSOS.ACTIVIDADES,,,,,,,5224.77
70,43120,47900,MERCADOS.TRANSFERENCIAS CORRENTES A EMPRESAS PRIVADAS,,,,,,,10000
70,43120,48900,MERCADOS. OUTRAS TRANSFERENCIAS,,,,,,,0
70,43120,62300,"MAQUINARIA, INSTALACIONS E UTILLAXE",,,,,,,24293.17
70,43120,62500,MOBILIARIO,,,,,,,8742.25
70,43120,72000,MERCADOS. TRANSFERENCIAS CAPITAL A A ADMON.ESTADO,,,,,,,0
70,43200,23000,AXUDAS CUSTE DOS MEMBROS ÓRGANOS DE GOBERNO,,,,,,,558.59
70,43200,23100,LOCOMOCIÓN.DOS MEMBROS ÓRGANOS DO GOBERNO,,,,,,,2124.04
70,43200,44900,TURISMO. APORTACIONS A SOCIEDADES MERCANTÍS MUNICIPAIS,,,,,,,2510000
70,43200,62600,EQUIPOS PRA PROCESOS DE INFORMACION,,,,,,,0
70,43200,64100,GASTOS EN APLICACIÓNS INFORMÁTICAS,,,,,,,0
70,43300,22699,PROMOCIÓN ECONÓMICA. OUTROS GASTOS DIVERSOS,,,,,,,198571.77
70,43300,22706,PROMOCIÓN ECONÓMICA. ESTUDIOS E TRABALLOS TÉCNICOS.,,,,,,,34954.91
70,43300,22799,OTROS TRABAJOS REALIZADOS POR OTRAS EMPRESAS Y PROFES.,,,,,,,14977.05
70,43300,44900,PROMOCIÓN ECONÓMICA. ACHEG A SOCIEDADES MERCANTÍS MUNICIPAIS,,,,,,,20609
70,43300,47900,PROMOCIÓN ECONOMICA.TRANSFER. CORRENTES A EMPRESAS PRIVADAS,,,,,,,112118.7
70,43300,47901,PROMOCIÓN ECONÓMICA. A EMPRESAS PRIVADAS.SANTIAGO INVESTORS,,,,,,,98858.89
70,43300,48900,PROMOCIÓN ECONÓMICA. OUTRAS TRANSFERENCIAS,,,,,,,0
70,43300,77000,PROMOCION ECONOMICA.TRANSFERENCIAS CAPITAL A EMPRESAS PRIVAD,,,,,,,29119.68
70,49300,21300,"OMIC. REPARAC. MANTEM, MAQUIN.,INSTA E UTILLA.",,,,,,,0
70,49300,22000,OMIC. MATERIAL ORDINARIO NON INVENTARIABLE.,,,,,,,0
70,49300,22001,"OMIC. PRENSA, REVISTAS, LIBROS E OUTRAS PUBLICACIONS.",,,,,,,0
70,49300,22699,OMIC. OUTROS GASTOS DIVERSOS,,,,,,,0
70,92300,22001,"ESTATISTICA. PRENSA, REVISTAS, LIBROS E OUTRAS PUBLICACIONS",,,,,,,90
70,92300,22699,ESTATÍSTICA. OUTROS GASTOS DIVERSOS,,,,,,,0
70,92300,22706,ESTATISTICA. ESTUDIOS E TRABALLOS TÉCNICOS.,,,,,,,10930.33
80,13200,12000,SEGURIDADE E ORDEN PÚBLICO.SOLDOS DO GRUPO A1.,,,,,,,32187.3
80,13200,12001,SEGURIDADE E ORDE PUBLICO.SOLDOS DO GRUPO A2,,,,,,,139697.4
80,13200,12003,SEGURIDADE E ORDEN PÚBLICO. SOLDOS DO GRUPO C1.,,,,,,,1399550.44
80,13200,12006,SEGURIDADE E ORDEN PÚBLICO. TRIENIOS.,,,,,,,320659.35
80,13200,12100,SEGURIDADE E ORDEN PÚBLICO. COMPLEMENTO DE DESTINO.,,,,,,,701905.48
80,13200,12101,SEGURIDADE E ORDEN PÚBLICO. COMPLEMENTO ESPECÍFICO.,,,,,,,1991175.44
80,13200,15000,SEGURIDADE E O.PUBLICCOMPLEMENTO PRODUCTIVIDADE FUNCIONARIOS,,,,,,,3669.48
80,13200,15100,SEGURIDADE E ORDE PUBLICO.GRATIFICACIONS FUNCIONARIOS,,,,,,,404936.17
80,13200,16000,SEGURIDADE E ORDEN PÚBLICO.SEGURIDADE SOCIAL.,,,,,,,1716511.71
80,13200,16400,SEGURIDADE E O.PUBLICO.COMPLEMENTO FAMILIAR DE PERSOAL,,,,,,,12816.67
80,13300,12001,TRÁFICO.SOLDOS DO GRUPO A2.,,,,,,,14115.1
80,13300,12003,TRÁFICO.SOLDOS DO GRUPO C1,,,,,,,10942.25
80,13300,12004,TRÁFICO.SOLDOS DO GRUPO C2,,,,,,,27375.22
80,13300,12006,TRÁFICO. TRIENIOS.,,,,,,,13008.52
80,13300,12100,TRÁFICO. COMPLEMENTO DE DESTINO.,,,,,,,25979.4
80,13300,12101,TRÁFICO. COMPLEMENTO ESPECÍFICO,,,,,,,73501.01
80,13300,13000,TRAFICO.RETRIBUCIONS BÁSICAS.,,,,,,,12080.01
80,13300,13002,TRAFICO.RETRIBUCIÓNS COMPLEMENTARIAS,,,,,,,12577.55
80,13300,16000,TRÁFICO.SEGURIDADE SOCIAL.,,,,,,,59820.71
80,13600,12001,BOMBEIROS.SOLDOS DO GRUPO A2.,,,,,,,0
80,13600,12003,BOMBEIROS. SOLDOS DO GRUPO C1.,,,,,,,14232.72
80,13600,12004,BOMBEIROS. SOLDOS DO GRUPO C2.,,,,,,,480060.53
80,13600,12006,BOMBEIROS. TRIENIOS.,,,,,,,85174.85
80,13600,12100,BOMBEIROS. COMPLEMENTO DE DESTINO.,,,,,,,232816.95
80,13600,12101,BOMBEIROS. COMPLEMENTO ESPECÍFICO.,,,,,,,733252.29
80,13600,15100,BOMBEIROS.GRATIFICACIONS FUNCIONARIOS,,,,,,,154710.88
80,13600,16000,BOMBEIROS.SEGURIDADE SOCIAL.,,,,,,,663170.99
80,13600,16400,BOMBEIROS. COMPLEMENTO FAMILIAR DE PERSOAL FUNCIONARIO,,,,,,,4183.34
80,15000,12000,VIVENDA. SOLDOS DO GRUPO A1.,,,,,,,175536.87
80,15000,12001,VIVENDA. SOLDOS DO GRUPO A2.,,,,,,,87500.95
80,15000,12003,VIVENDA. SOLDOS DO GRUPO C1.,,,,,,,129413.14
80,15000,12004,VIVENDA. SOLDOS DO GRUPO C2.,,,,,,,57600.81
80,15000,12006,VIVENDA. TRIENIOS.,,,,,,,101386.92
80,15000,12100,VIVENDA. COMPLEMENTO DE DESTINO.,,,,,,,215513.49
80,15000,12101,V IVENDA. COMPLEMENTO ESPECÍFICO.,,,,,,,625081.01
80,15000,13000,VIVENDA. RETRIBUCIONS BÁSICAS.,,,,,,,40607.16
80,15000,13002,VIVENDA. RETRIBUCIONS COMPLEMENTARIAS,,,,,,,41587.39
80,15000,13100,RETRIBUCIÓNS PERSOAL LABORAL TEMPORAL,,,,,,,4947.63
80,15000,13102,OUTRAS REMUNERACIÓNS. LABORAIS TEMPORAIS,,,,,,,5806.78
80,15000,16000,VIVENDA. SEGURIDADE SOCIAL.,,,,,,,433438.46
80,15320,12003,INFRAESTRUCTURAS.SOLDOS DO GRUPO C1.,,,,,,,10942.25
80,15320,12004,INFRAESTRUCTURAS. SOLDOS DO GRUPO C2.,,,,,,,53619.33
80,15320,12006,INFRAESTRUCTURAS. TRIENIOS.,,,,,,,18682.7
80,15320,12100,INFRAESTRUCTURAS. COMPLEMENTO DE DESTINO.,,,,,,,31561.64
80,15320,12101,INFRAESTRUCTURAS. COMPLEMENTO ESPECÍFICO.,,,,,,,85763.71
80,15320,13000,INFRAESTRUCTURAS. RETRIBUCIONS BÁSICAS.,,,,,,,37371.95
80,15320,13002,INFRAESTRUCTURAS. RETRIBUCIONS COMPLEMENTARIAS,,,,,,,35734.11
80,15320,13100,INFRAESTRUCTURAS.RETRIBUCIÓNS PERSOAL LABORAL TEMPORAL,,,,,,,10416.04
80,15320,13102,INFRAESTRUCTURAS.RETR.COMPLEM.LABORAIS TEMPORAIS,,,,,,,12224.76
80,15320,16000,INFRAESTRUCTURAS. SEGURIDADE SOCIAL.,,,,,,,119752.76
80,15320,16202,TRANSPORTE DE PERSONAL.,,,,,,,4574.34
80,15320,16400,INFRAESTRUCTURA .COMPLEMENTO FAMILIAR DE PERSOAL FUNCIONARIO,,,,,,,3600
80,17100,12003,PARQUES E XARDINS. SOLDOS DO GRUPO C1.,,,,,,,52957.69
80,17100,12004,PARQUES E XARDINS. SOLDOS DO GRUPO C2.,,,,,,,91056.58
80,17100,12006,PARQUES E XARDINS. TRIENIOS.,,,,,,,33100.71
80,17100,12100,PARQUES E XARDINS. COMPLEMENTO DE DESTINO.,,,,,,,67018.59
80,17100,12101,PARQUES E XARDINS. COMPLEMENTO ESPECÍFICO.,,,,,,,175197.61
80,17100,13000,PARQUES E XARDINS. RETRIBUCIONS BÁSICAS.,,,,,,,25944.89
80,17100,13002,PARQUES E XARDINS.RETRIBUCIONS COMPLEMENTARIAS,,,,,,,26220.48
80,17100,16000,PARQUES E XARDINS. SEGURIDADE SOCIAL.,,,,,,,153756.74
80,17200,12000,MEDIO AMBIENTE. SOLDOS DO GRUPO A1.,,,,,,,31770.8
80,17200,12001,MEDIO AMBIENTE. SOLDOS DO GRUPO A2.,,,,,,,13966.5
80,17200,12006,MEDIO AMBIENTE. TRIENIOS.,,,,,,,9064.97
80,17200,12100,MEDIO AMBIENTE.COMPLEMENTO DE DESTINO.,,,,,,,20108.16
80,17200,12101,MEDIO AMBIENTE. COMPLEMENTO ESPECÍFICO.,,,,,,,63270.77
80,17200,13000,RETRIBUCIONS BÁSICAS.,,,,,,,465.28
80,17200,16000,MEDIO AMBIENTE. SEGURIDADE SOCIAL.,,,,,,,33172.74
80,23100,12000,ADMINISTRACION XERAL DE SERVIZOS SOCIAS. SOLDOS DO GRUPO A1,,,,,,,16392.68
80,23100,12001,ADMINISTRACION XERAL SERVIZOS SOCIAIS. SOLDOS DO GRUPO A2,,,,,,,14115.1
80,23100,12003,ADMINISTRACION XERAL DE SERVIZOS SOCIAIS.SOLDOS DO GRUPO C1,,,,,,,10708.32
80,23100,12004,ADMINISTRACION XERAL DE SERVIZOS SOCIAIS.SOLDOS DO GRUPO C2.,,,,,,,9109.89
80,23100,12006,ADMINISTRACIÓN XERAL DE SERVIZOS SOCIAIS. TRIENIOS.,,,,,,,13833.47
80,23100,12100,ADMINISTRACIÓN XERAL SERVIZOS SOCIAIS.COMPLEMENTO D DESTINO,,,,,,,25920.48
80,23100,12101,ADMINISTRACION XERAL SERVIZOS SOCIAISCOMPLEMENTO ESPECÍFICO,,,,,,,75234.71
80,23100,13000,ADMINISTRACIÓN XERAL SERVICIOS SOCIAIS.RETRIBUCIONS BASICAS,,,,,,,278747.84
80,23100,13002,ADMON.XERAL SERVIZOS SOCIAIS.RETRIBUCIONS COMPLEMENTARIAS,,,,,,,380978.15
80,23100,16000,ADMINISTRACION XERAL DE SERVIZOS SOCIAIS.SEGURIDADE SOCIAL.,,,,,,,232987.61
80,23100,16400,COMPLEMENTO FAMILIAR DE PERSOAL FUNCIONARIO,,,,,,,7200
80,23101,13000,UMASD. RETRIBUCIONS BÁSICAS.,,,,,,,254959.68
80,23101,13002,UMAD. RETRIBUCIONS COMPLEMENTARIAS,,,,,,,304398.37
80,23101,16000,UMAD. SEGURIDADE SOCIAL.,,,,,,,179024.03
80,23102,13000,MULLER. RETRIBUCIONS BÁSICAS.,,,,,,,34861.61
80,23102,13002,MULLER. RETRIBUCIONS COMPLEMENTARIAS,,,,,,,35909.28
80,23102,16000,MULLER. SEGURIDADE SOCIAL.,,,,,,,21813.36
80,23103,13000,EMIGRACIÓN/INMIGRACIÓN. RETRIBUCIONS BÁSICAS.,,,,,,,20586.42
80,23103,13002,EMIGRACIÓN/INMIGRACIÓN. RETRIBUCIONS COMPLEMENTARIAS,,,,,,,21165.12
80,23103,16000,EMIGRACIÓN/INMIGRACIÓN. SEGURIDADE SOCIAL.,,,,,,,12811.18
80,24100,12001,FOMENTO DO EMPREGO. SUELDOS DEL GRUPO A2.,,,,,,,30008.26
80,24100,12003,FOMENTO DE EMPREGO.SOLDOS DO GRUP C1,,,,,,,9220.18
80,24100,12004,FOMENTO DO EMPREGO. SOLDOS DO GRUPO C2.,,,,,,,9109.89
80,24100,12006,FOMENTO DO EMPREGO. TRIENIOS.,,,,,,,4106.64
80,24100,12100,FOMENTO DO EMPREGO. COMPLEMENTO DE DESTINO.,,,,,,,18317.7
80,24100,12101,FOMENTO DO EMPREGO.COMPLEMENTO ESPECÍFICO.,,,,,,,47176.9
80,24100,13000,FOMENTO DO EMPREGO. RETRIBUCIONS BÁSICAS.,,,,,,,30185.05
80,24100,13002,FOMENTO DO EMPREGO. RETRIBUCIONS COMPLEMENTARIAS,,,,,,,30360.49
80,24100,13100,FOMENTO EMPREGO. RETRIBUCIÓNS PERSOAL LABORAL TEMPORAL,,,,,,,274772.34
80,24100,13101,RETRIBUCIÓNS PERSOAL LABORAL TEMPORAL. OBRADOIRO,,,,,,,51701.87
80,24100,13102,FOMENTO EMPREGO. OUTRAS REMUNERACIÓNS. LABORAIS TEMPORAIS,,,,,,,29813.76
80,24100,13103,LABORAL TEMPORAL. OUTRAS REMUNERACIÓNS VARIABLES OBRADOIRO,,,,,,,101545.54
80,24100,16000,FOMENTO DO EMPREGO. SEGURIDADE SOCIAL.,,,,,,,179630.93
80,24100,62300,"MAQUINARIA, INSTALACIONS E UTILLAXE",,,,,,,0
80,31100,12003,SANIDADE. SOLDOS DO GRUPO C1.,,,,,,,10799.64
80,31100,12004,SANIDADE. SOLDOS DO GRUPO C2.,,,,,,,27093.2
80,31100,12006,SANIDADE. TRIENIOS.,,,,,,,9840.58
80,31100,12100,SANIDADE. COMPLEMENTO DE DESTINO.,,,,,,,17735.79
80,31100,12101,SANIDADE. COMPLEMENTO ESPECÍFICO.,,,,,,,48417.74
80,31100,16000,SANIDADE. SEGURIDADE SOCIAL.,,,,,,,38228.87
80,32000,12000,ADMINISTRACIÓN XERAL DA EDUCACIÓN.SOLDOS DO GRUPO A1.,,,,,,,15885.4
80,32000,12006,ADMINISTRACIÓN XERAL DA EDUCACIÓN. TRIENIOS.,,,,,,,5652.97
80,32000,12100,ADMINISTRACIÓN XERAL DA EDUCACIÓN.COMPLEMENTO DE DESTINO,,,,,,,6995.04
80,32000,12101,ADMINISTRACIÓN XERAL DA EDUCACIÓN.COMPLEMENTO ESPECÍFICO.,,,,,,,22633.07
80,32000,13000,ADMINISTRACIÓN XERAL DA EDUCACIÓN. RETRIBUCIONS BÁSICAS.,,,,,,,22909.95
80,32000,13002,ADMINISTRACIÓN XERAL EDUCACIÓN RETRIBUCIONS COMPLEMENTARIAS,,,,,,,21281.4
80,32000,16000,ADMINISTRACIÓN XERAL DA EDUCACIÓN. SEGURIDADE SOCIAL.,,,,,,,24270.69
80,33400,12000,PROMOCIÓN CULTURAL. SOLDOS DO GRUPO A1.,,,,,,,15736.8
80,33400,12006,PROMOCIÓN CULTURAL. TRIENIOS.,,,,,,,2261.19
80,33400,12100,PROMOCIÓN CULTURAL. COMPLEMENTO DE DESTINO.,,,,,,,6118.08
80,33400,12101,PROMOCIÓN CULTURAL. COMPLEMENTO ESPECÍFICO.,,,,,,,18200.16
80,33400,16000,PROMOCIÓN CULTURAL. SEGURIDADE SOCIAL.,,,,,,,10640.86
80,33401,12001,BANDA DE MUSICA. SOLDOS DO GRUPO A2.,,,,,,,286079.33
80,33401,12003,BANDA DE MUSICA. SOLDOS DO GRUPO C1.,,,,,,,61058.64
80,33401,12006,BANDA DE MUSICA. TRIENIOS.,,,,,,,62754.41
80,33401,12100,BANDA DE MUSICA. COMPLEMENTO DE DESTINO.,,,,,,,133688.81
80,33401,12101,BANDA DE MUSICA. COMPLEMENTO ESPECÍFICO.,,,,,,,325402.42
80,33401,13000,BANDA DE MÚSICA. RETRIBUCIONS BÁSICAS.,,,,,,,76216.96
80,33401,13002,BANDA DE MÚSICA. RETRIBUCIONS COMPLEMENTARIAS,,,,,,,126301.37
80,33401,13100,RETRIBUCIÓNS PERSOAL LABORAL TEMPORAL,,,,,,,20502.5
80,33401,13102,OUTRAS REMUNERACIÓNS. LABORAIS TEMPORAIS,,,,,,,34951.08
80,33401,16000,BANDA DE MUSICA. SEGURIDADE SOCIAL.,,,,,,,361732.47
80,33401,16400,COMPLEMENTO FAMILIAR DE PERSOAL FUNCIONARIO,,,,,,,3600
80,33402,13000,NORMALIZACIÓN LINGUISTICA. RETRIBUCIONS BÁSICAS.,,,,,,,23539.84
80,33402,13002,NORMALIZACIÓN LINGUISTICA. RETRIBUCIONS COMPLEMENTARIAS,,,,,,,25912.68
80,33402,16000,NORMALIZACIÓN LINGUISTICA. SEGURIDADE SOCIAL.,,,,,,,13368.33
80,33403,13000,CENTROS SOCIOCULTURAIS. RETRIBUCIONS BÁSICAS.,,,,,,,253817.51
80,33403,13002,CENTROS SOCIOCULTURAIS. RETRIBUCIONS COMPLEMENTARIAS,,,,,,,279352.58
80,33403,13100,CENTROS SOCIOCULTURAIS.RETRIBUCIÓNS PERSOAL LABORAL TEMPORAL,,,,,,,51141.77
80,33403,13102,CENTROS SOCIOCULTURAIS.RET.COMPLEMENT.LABORAIS TEMPORAIS,,,,,,,62500.57
80,33403,16000,CENTROS SOCIOCULTURAIS. SEGURIDADE SOCIAL.,,,,,,,203066.35
80,33403,22700,REXIME INTERIOR E PERSOAL. CSC. LIMPEZA E ASEO.,,,,,,,244545.14
80,33404,12003,P.CULTURAL.ASOCIACION VECIÑAIS.SOLDOS GRUPO C1,,,,,,,21507.96
80,33404,12006,P.ULTURAL.ASOCIACIONS VECIÑAS.TRIENIOS,,,,,,,5626.18
80,33404,12100,PROMOCION CULTURAL.AA.VV.COMPLEMENTO DE DESTINO.,,,,,,,10013.88
80,33404,12101,P.CULTURAL.AA.VV.COMPLEMENTO ESPECÍFICO.,,,,,,,25651.06
80,33404,16000,PROMOCION CULTURAL.ASOCIACION VECIÑAIS.SEGURIDADE SOCIAL.,,,,,,,22076.71
80,33600,12000,CASCO HISTORICO. SOLDOS DO GRUPO A1.,,,,,,,106439.08
80,33600,12001,CASCO HISTORICO. SOLDOS DO GRUPO A2.,,,,,,,13823.89
80,33600,12003,CASCO HISTORICO. SOLDOS DO GRUPO C1.,,,,,,,10708.32
80,33600,12004,CASCO HISTORICO. SOLDOS DO GRUPO C2.,,,,,,,25817.28
80,33600,12006,CASCO HISTORICO. TRIENIOS.,,,,,,,18353.99
80,33600,12100,CASCO HISTORICO. COMPLEMENTO DE DESTINO.,,,,,,,67841.96
80,33600,12101,CASCO HISTORICO. COMPLEMENTO ESPECÍFICO.,,,,,,,198398.22
80,33600,13000,CASCO HISTÓRICO. RETRIBUCIONS BÁSICAS.,,,,,,,36350.23
80,33600,13002,CASCO HISTORICO. RETRIBUCIONS COMPLEMENTARIAS,,,,,,,38753.04
80,33600,16000,CASCO HISTORICO. SEGURIDADE SOCIAL.,,,,,,,147277.82
80,33800,12003,FESTEXOS.SOLDOS DO GRUPO C1,,,,,,,10799.64
80,33800,12004,FESTEXOS. SOLDOS DO GRUPO C2.,,,,,,,9109.89
80,33800,12006,FESTEXOS. TRIENIOS.,,,,,,,5409.86
80,33800,12100,FESTEXOS. COMPLEMENTO DE DESTINO.,,,,,,,9475.56
80,33800,12101,FESTEXOS. COMPLEMENTO ESPECÍFICO.,,,,,,,24362.17
80,33800,16000,FESTEXOS. SEGURIDADE SOCIAL.,,,,,,,20183.94
80,34000,12003,PROMOCIÓN E FOMENTO DO DEPORTE.SOLDOS DO GRUPO C1.,,,,,,,10708.32
80,34000,12006,PROMOCIÓN E FOMENTO DO DEPORTE. TRIENIOS.,,,,,,,1768.86
80,34000,12100,PROMOCIÓN E FOMENTO DO DEPORTE.COMPLEMENTO DE DESTINO.,,,,,,,4737.48
80,34000,12101,PROMOCIÓN E FOMENTO DO DEPORTE. COMPLEMENTO ESPECÍFICO.,,,,,,,11907.08
80,34000,13000,PROMOCIÓN E FOMENTO DEPORTE. RETRIBUCIONS BÁSICAS.,,,,,,,143983.14
80,34000,13002,PROMOCIÓN E FOMENTO DEPORTE. RETRIBUCIONS COMPLEMENTARIAS,,,,,,,150886.18
80,34000,16000,PROMOCIÓN E FOMENTO DO DEPORTE. SEGURIDADE SOCIAL.,,,,,,,101864.21
80,34200,22700,REXIME INTERIOR E PERSOAL. DEPORTES. LIMPEZA E ASEO.,,,,,,,165065.33
80,43120,13000,MERCADOS. RETRIBUCIONS BÁSICAS.,,,,,,,5471.26
80,43120,13002,MERCADOS. RETRIBUCIONS COMPLEMENTARIAS,,,,,,,1853.95
80,43120,16000,MERCADOS. SEGURIDADE SOCIAL.,,,,,,,7856.88
80,43300,12000,ECONOMIA.DESARROLLO EMPRESARIAL.SOLDOS DO GRUPO A1,,,,,,,45185.91
80,43300,12006,ECONOMIA.DESARROLLO EMPRESARIAL. TRIENIOS.,,,,,,,7416.52
80,43300,12100,ECONOMIA.DESARROLLO EMPRESARIAL.COMPLEMENTO DE DESTINO.,,,,,,,21300.65
80,43300,12101,ECONOMIA.DESARROLLO EMPRESARIAL. COMPLEMENTO ESPECÍFICO.,,,,,,,60639.17
80,43300,13000,ECONOMÍA DESARROLLO EMPRESARIAL. RETRIBUCIONS BÁSICAS.,,,,,,,31731.9
80,43300,13002,ECONOMIA DESARROLLO EMPRESARIAL RETRIBUCIONS COMPLEMENTARIAS,,,,,,,88091.65
80,43300,13100,RETRIBUCIÓNS PERSOAL LABORAL TEMPORAL,,,,,,,505.99
80,43300,16000,ECONOMIA.DESARROLLO EMPRESARIAL. SEGURIDADE SOCIAL.,,,,,,,60231.76
80,49100,22200,SERVICIOS DE TELECOMUNICACIONES.,,,,,,,208857.98
80,49300,12003,OMIC. SOLDOS DO GRUPO C1.,,,,,,,10942.25
80,49300,12006,OMIC. TRIENIOS.,,,,,,,3257.44
80,49300,12100,OMIC. COMPLEMENTO DE DESTINO.,,,,,,,6118.08
80,49300,12101,OMIC. COMPLEMENTO ESPECÍFICO.,,,,,,,17880.86
80,49300,13000,OMIC. RETRIBUCIONS BÁSICAS.,,,,,,,13319.69
80,49300,13002,OMIC. RETRIBUCIONS COMPLEMENTARIAS,,,,,,,13110.24
80,49300,16000,OMIC. SEGURIDAD SOCIAL.,,,,,,,20855.01
80,91200,10000,ORGANOS DE GOBERNO.RETRIBUCIONES BÁSICAS.,,,,,,,302265.96
80,91200,10001,ORGANOS DE GOBERNO.RETRIBUCIÓNS COMPLEMENTARIAS,,,,,,,359373.31
80,91200,11000,ORGANOS GOBERNO.RETRIBUCIONES BÁSICAS.,,,,,,,206673.1
80,91200,11001,ORGANOS DE GOBERNO. RETRIBUCIONES COMPLEMENTARIAS.,,,,,,,255474.49
80,91200,12000,ORGANOS DE GOBERNO.SOLDOS DO GRUPO A1.,,,,,,,6062.8
80,91200,12003,ORGANOS DE GOBERNO. SOLDOS DO GRUPO C1.,,,,,,,10799.64
80,91200,12004,ORGANOS DE GOBERNO. SOLDOS DO GRUPO C2.,,,,,,,27292.61
80,91200,12006,ORGANOS DE GOBERNO. TRIENIOS.,,,,,,,11139
80,91200,12100,ORGANOS DE GOBERNO. COMPLEMENTO DE DESTINO.,,,,,,,23627.68
80,91200,12101,ORGANOS DE GOBERNO. COMPLEMENTO ESPECÍFICO.,,,,,,,59821.64
80,91200,16000,ORGANOS DE GOBERNO. SEGURIDADE SOCIAL.,,,,,,,337897.65
80,92000,12000,ADMINISTRACIÓN XERAL. SOLDOS DO GRUPO A1.,,,,,,,187719.29
80,92000,12001,ADMINISTRACIÓN XERAL. SOLDOS DO GRUPO A2.,,,,,,,109576.23
80,92000,12003,ADMINISTRACIÓN XERAL. SOLDOS DO GRUPO C1.,,,,,,,177910.9
80,92000,12004,ADMINISTRACIÓN XERAL. SOLDOS DO GRUPO C2.,,,,,,,199257.57
80,92000,12005,ADMINISTRACIÓN XERAL. SOLDOS DO GRUPO E.,,,,,,,49604.13
80,92000,12006,ADMINISTRACIÓN XERAL. TRIENIOS.,,,,,,,131002.76
80,92000,12100,ADMINISTRACIÓN XERAL. COMPLEMENTO DE DESTINO.,,,,,,,333504.77
80,92000,12101,ADMINISTRACIÓN XERAL. COMPLEMENTO ESPECÍFICO.,,,,,,,929313.51
80,92000,12104,RETRIBUCIONES COMPLEMENTARIAS.ADECUACION POSTOS TRABALLO,,,,,,,0
80,92000,13000,ADMINISTRACIÓN XERAL. RETRIBUCIONS BÁSICAS.,,,,,,,224735.95
80,92000,13001,HORAS EXTRAORDINARIAS,,,,,,,5739.77
80,92000,13002,ADMINISTRACIÓN XERAL. RETRIBUCIONS COMPLEMENTARIAS,,,,,,,199960.54
80,92000,13100,ADMINISTRACIÓN XERAL. RETRIBUCIÓNS PERSOAL LABORAL TEMPORAL,,,,,,,143509.95
80,92000,13101,RETRIBUCIÓNS PERSOAL LABORAL TEMPORAL. OUTROS,,,,,,,1180.19
80,92000,13102,ADMINISTRACIÓN XERAL.RET.COMPLEMEN.LABORAL TEMPORAL,,,,,,,175913.79
80,92000,15000,COMPLEMENTO PRODUCTIVIDADE FUNCIONARIOS,,,,,,,196135.66
80,92000,15100,GRATIFICACIONS FUNCIONARIOS,,,,,,,30158.03
80,92000,16000,ADMINISTRACIÓN XERAL. SEGURIDADE SOCIAL.,,,,,,,955718.05
80,92000,16108,OUTRAS PRESTACIÓNS SOCIAIS,,,,,,,1138996.59
80,92000,16200,FORMACIÓN E PERFECCIONAMIENTO DEL PERSONAL.,,,,,,,59234.87
80,92000,16202,TRANSPORTE DE PERSONAL.,,,,,,,3379.62
80,92000,16209,OTROS GASTOS SOCIALES.,,,,,,,0
80,92000,16400,COMPLEMENTO FAMILIAR DE PERSOAL FUNCIONARIO,,,,,,,6091.66
80,92000,20200,ADMINISTRACIÓN XERAL. ARRENDAM. EDIFICIOS E OUTRAS CONSTR.,,,,,,,143459.83
80,92000,20400,ADMINISTRACIÓN XERAL. ARRENDAMENTO MATERIAL DE TRANSPORTE,,,,,,,44437.25
80,92000,21000,ADMON.XERAL.REPARAC. MANTEM. E CONSERVAC. INFRAESTR.,,,,,,,0
80,92000,21200,ADMINISTRACIÓN XERAL.REPARAC. MANTEM. EDIFICIOS E O.CONSTRUC,,,,,,,63312.96
80,92000,21300,"ADMON.  XERALREPARAC. MANTEM, MAQUIN.,INSTA E UTILLA.",,,,,,,3154.32
80,92000,21400,ADMÓN. XERAL. REPARAC. MANTEM. MATERIAL TRANSPORTE,,,,,,,61792.7
80,92000,21600,ADMON. XERAL. REPARA. MANTEN. EQUIPOS PROCESOS INFORM.,,,,,,,4017
80,92000,22000,ADMINISTRACIÓN XERAL. ORDINARIO NON INVENTARIABLE.,,,,,,,36666.96
80,92000,22001,"ADMON.XERAL. PRENSA, REVISTAS, LIBROS E OUTRAS PUBLICACIONS",,,,,,,6593.16
80,92000,22103,ADMINISTRACIÓN XERAL. COMBUSTIBLES E CARBURANTES.,,,,,,,116121.54
80,92000,22104,ADMINISTRACIÓN XERAL. VESTIARIO.,,,,,,,12284.09
80,92000,22110,ADMINISTRACIÓN XERAL. PRODUCTOS DE LIMPEZA E ASEO.,,,,,,,0
80,92000,22201,ADMINISTRACIÓN XERAL. POSTAIS.,,,,,,,324868.32
80,92000,22400,ADMINISTRACIÓN XERAL. PRIMAS DE SEGUROS,,,,,,,0
80,92000,22401,ADMÒN. XERAL. PRIMAS DE SEGUROS. PARQUE MÓBIL,,,,,,,25382.82
80,92000,22402,ADMINISTRACIÓN XERAL.PRIMAS DE SEGUROS.SRC PATRIMONIAL,,,,,,,64507.15
80,92000,22403,ADMÓN XERAL.PRIMAS DE SEGUROS.SEG.ACCIDENTES EMPREGADOS PUBL,,,,,,,12571.43
80,92000,22602,ADMINISTRACIÓN XERAL. PUBLICIDADE E PROPAGANDA.,,,,,,,0
80,92000,22603,ADMINISTRACIÓN XERAL. PUBLICACIÓN EN DIARIOS OFICIALES.,,,,,,,7276.38
80,92000,22604,"ADMINISTRACIÓN XERAL. XURÍDICOS, CONTENCIOSOS.",,,,,,,355161.22
80,92000,22699,ADMINISTRACIÓN XERAL. OUTROS GASTOS DIVERSOS,,,,,,,91194.85
80,92000,22700,ADMINISTRACIÓN XERAL. LIMPEZA E ASEO.,,,,,,,529127.57
80,92000,22701,ADMINISTRACIÓN XERAL. SEGURIDADE.,,,,,,,3452.29
80,92000,22705,ADMINISTRACIÓN XERAL. PROCESOS ELECTORAIS.,,,,,,,4018.17
80,92000,22706,ADMINISTRACIÓN XERAL. ESTUDOS E TRABALLOS TÉCNICOS.,,,,,,,66929.48
80,92000,22799,ADMON.XERAL.OUTROS TRABALLOS REALIZADOS POR OUTRAS EMPRESAS,,,,,,,458.1
80,92000,23020,ADMINISTRACIÓN XERAL. AXUDAS CUSTE DO PERSOAL NON DIRECTIVO,,,,,,,6413.06
80,92000,23120,ADMINISTRACIÓN XERAL. LOCOMOCIÓN DO PERSOAL NON DIRECTIVO.,,,,,,,10029.84
80,92000,23300,ADMINISTRACIÓN XERAL.OUTRAS INDEMNIZACIÓNS,,,,,,,0
80,92000,35200,XUROS DE MORA,,,,,,,65563.78
80,92000,83000,ADMINISTRACIÓN XERAL. ANTICIPOS DE PAGAS O PERSOAL,,,,,,,66953.86
80,92001,12000,INFORMATICA E REFORMA ADMTVA.SOLDOS DO GRUPO A1.,,,,,,,16392.68
80,92001,12001,INFORMATICA E REFORMA ADMTVA. SOLDOS DO GRUPO A2.,,,,,,,28464.6
80,92001,12003,INFORMATICA E REFORMA ADMTVA. SOLDOS DO GRUPO C1.,,,,,,,54090.79
80,92001,12006,INFORMATICA E REFORMA ADMTVA. TRIENIOS.,,,,,,,18136.25
80,92001,12100,INFORMATICA E REFORMA ADMTVA. COMPLEMENTO DE DESTINO.,,,,,,,52555.38
80,92001,12101,INFORMATICA E REFORMA ADMTVA. COMPLEMENTO ESPECÍFICO.,,,,,,,149163.21
80,92001,16000,INFORMATICA E REFORMA ADMTVA. SEGURIDADE SOCIAL.,,,,,,,79960.45
80,92001,21300,"INFORMATICA. REPARAC. MANTEM, MAQUIN.,INSTA E UTILLA.",,,,,,,0
80,92001,21600,INFORMATICA. REPARA. MANTEN. EQUIPOS PROCESOS INFORM.,,,,,,,9388.12
80,92001,22001,"INFORMATICA. PRENSA, REVISTAS, LIBROS Y OTRAS PUBLICACIONES.",,,,,,,23748.76
80,92001,22002,INFORMATICA. MATERIAL INFORMÁTICO NO INVENTARIABLE.,,,,,,,28036.38
80,92001,22112,"SUMIN. DE MATERIAL ELECTRÓNICO, ELÉCTRICO Y DE TELECOMUNIC.",,,,,,,0
