#Org.,Pro.,Eco.,Descripción,,,,,,,O
80,92001,22699,INFORMATICA. OUTROS GASTOS DIVERSOS,,,,,,,1148.4
80,92001,22706,INFORMATICA. ESTUDOS E TRABALLOS TÉCNICOS.,,,,,,,94409.6
80,92001,22799,INFORMATICA.OUTROS TRABALLOS REALIZADOS POR OUTRAS EMPRESAS,,,,,,,221790.2
80,92001,62600,EQUIPOS PRA PROCESOS DE INFORMACION,,,,,,,154466.35
80,92002,13100,PRESIDENCIA.RETRIBUCIÓNS PERSOAL LABORAL TEMPORAL,,,,,,,19547.49
80,92002,13102,PRESIDENCIA.RETRIBUCIONS COMPLEMENTARIAS.P.LABORAL TEMPORAL,,,,,,,25912.68
80,92002,16000,PRESIDENCIA. SEGURIDADE SOCIAL.,,,,,,,13887.46
80,92500,12000,PRESTACIÓNS SOCIAIS. SOLDOS DEL GRUPO A1.,,,,,,,15885.4
80,92500,12003,PRESTACIÓNS SOCIAIS. SOLDOS DO GRUPO C1.,,,,,,,20529.37
80,92500,12004,PRESTACIÓNS SOCIAIS. SOLDOS DO GRUPO C2.,,,,,,,44122.28
80,92500,12006,PRESTACIÓNS SOCIAIS. TRIENIOS.,,,,,,,23061.34
80,92500,12100,PRESTACIÓNS SOCIAIS. COMPLEMENTO DE DESTINO.,,,,,,,36609.34
80,92500,12101,PRESTACIÓNS SOCIAIS. COMPLEMENTO ESPECÍFICO.,,,,,,,100266.05
80,92500,16000,PRESTACIÓNS SOCIAIS. SEGURIDADE SOCIAL.,,,,,,,79547.01
80,92500,21600,PRESTACIÓN SOCIAIS. REPARA. MANTEN. EQUIPOS PROCESOS INFORM.,,,,,,,273.94
80,93100,12000,POLITICA ECONÓMICA E FISCAL. SOLDOS DO GRUPO A1.,,,,,,,91537.16
80,93100,12001,POLITICA ECONÓMICA E FISCAL. SOLDOS DO GRUPO A2.,,,,,,,87591.16
80,93100,12003,POLITICA ECONÓMICA E FISCAL. SOLDOS DO GRUPO C1.,,,,,,,105072.19
80,93100,12004,POLITICA ECONOMICA E FISCAL. SOLDOS DO GRUPO C2,,,,,,,52608.74
80,93100,12006,POLITICA ECONÓMICA E FISCAL. TRIENIOS.,,,,,,,72759.94
80,93100,12100,POLITICA ECONÓMICA E FISCAL. COMPLEMENTO DE DESTINO.,,,,,,,176623.65
80,93100,12101,POLITICA ECONÓMICA E FISCAL. COMPLEMENTO ESPECÍFICO.,,,,,,,503149.93
80,93100,13000,POLITICA ECONÓMICA E FISCAL. RETRIBUCIONS BÁSICAS.,,,,,,,138509.2
80,93100,13002,POLITICA ECONÓMICA E FISCAL. RETRIBUCIONS COMPLEMENTARIAS,,,,,,,136437.21
80,93100,13100,POLITICA FISCAL Y ECONOMICA.RETRIBUCIÓNS LABORAL TEMPORAL,,,,,,,17714.3
80,93100,13102,POLITICA ECONOMICA FISCAL.RET.COMPLEMT.LABORAL TEMPORAL,,,,,,,19854.32
80,93100,16000,POLITICA ECONOMICA E FISCAL. SEGURIDADE SOCIAL.,,,,,,,394591.01
80,93100,16400,COMPLEMENTO FAMILIAR DE PERSOAL FUNCIONARIO,,,,,,,3600
90,33403,63200,INV. REPOSICION EDIFICIOS E CONSTRUCC.,,,,,,,0
90,33404,21200,P.CULTURAL ASOCIACIÓN VECIÑAIS.REP.MANTEN.EDF.E O.CONSTRUC.,,,,,,,3307.52
90,33404,21300,"REPARAC. MANTEM, MAQUIN.,INSTA E UTILLA.",,,,,,,4833.12
90,33404,21600,REPARA. MANTEN. EQUIPOS PROCESOS INFORM.,,,,,,,2059.65
90,33404,22000,P.CULTURAL.ASOCIACIONS VECIÑAIS.ORDINARIO NON INVENTARIABLE.,,,,,,,0
90,33404,22001,"P.CULTURAL. AA.VV.PRENSA,REVISTAS,LIBROS E O.PUBLICACIONS",,,,,,,1420.18
90,33404,22101,AGUA.,,,,,,,20.62
90,33404,22102,PROMOCION CULTURAL ASOCIACION VECIÑAIS.GAS.,,,,,,,3011.18
90,33404,22300,P.CULTURAL.ASOCIACIONS VECIÑAIS. TRANSPORTES.,,,,,,,0
90,33404,22699,P.CULTURAL.ASOCIACIONS VECIÑAIS.OUTROS GASTOS DIVERSOS,,,,,,,12240.3
90,33404,22701,SEGURIDAD.,,,,,,,1099.95
90,33404,22706,ESTUDIOS Y TRABAJOS TÉCNICOS.,,,,,,,108.9
90,33404,22799,P.CULTURAL.AA.VV.OUTROS TRABALLOS REALIZADOS OUTRAS EMPRESAS,,,,,,,5021.5
90,33404,48901,P.CULTURAL.ASOCIACIONS VECIÑAIS.OUTRAS TRANSFERENCIAS,,,,,,,56220.79
#,,,,,,,,,,89687032.49
