#Org.,Prog.,Econ.,Denominación,Vinc. Org.,Vinc. Fun.,Vinc. Eco.,Créditos Iniciales,Modificaciones de Crédito,Créditos Definitivos,Obligaciones Reconocidas
30,15000,1200600,ADMON. XERAL VIVENDA E URBANISMO.  FUNC. CARREIRA. TRIENIOS,30,1,1,105030.48,0,105030.48,104913.47
30,15000,1200610,ADMON. XERAL VIVENDA E URBANISMO.  FUNC. INTERINOS. TRIENIOS,30,1,1,1008.72,1022.35,2031.07,10425.98
30,15000,1200620,ADMON. XERAL VIVENDA E URBANISMO.  FUNC. INTERINOS. TRIENIOS,30,1,1,1002.63,589.89,1592.52,1563.85
30,15000,1200630,FUNC. INTERINOS. ACUM TAREFAS E IT. TRIENIOS,30,1,1,0,337.02,337.02,337.02
30,15000,1210000,ADMON. XERAL VIV E URB.  FUNC. CARREIRA. COMPLEM DE DESTINO,30,1,1,243672.6,0,243672.6,182290.83
30,15000,1210010,ADMON. XERAL VIV E URB.  FUNC. INTERINOS. COMPL DE DESTINO,30,1,1,4467.84,0,4467.84,41153.96
30,15000,1210020,ADMON. XERAL VIVENDA E URB.  PROG ESPECÍFICOS. COMPL DESTIN,30,1,1,20390.78,6939.64,27330.42,26552.64
30,15000,1210030,ADMON. XERAL VIV E URB.  FUNC. INTER. ACUM TAREF. C.DESTINO,30,1,1,2573.06,1317.36,3890.42,3890.42
30,15000,1210100,ADMON. XERAL VIV E URB.  FUNC. CARREIRA. COMPL ESPECÍFICO,30,1,1,673095.6,-166000,507095.6,506371.6
30,15000,1210110,ADMON. XERAL VIV E URB.  FUNC. INTERINOS. COMPL ESPECÍFICO,30,1,1,11475.8,0,11475.8,109266.46
30,15000,1210120,ADMON. XERAL VIV E URB.  PROG ESPECÍFICOS. COMPL ESPECÍFICO,30,1,1,51351.08,17572.09,68923.17,66511.9
30,15000,1210130,ADMON. XERAL VIV E RUB.  FUNC. INTER. ACUM TAREFAS. C. ESPEC,30,1,1,6424.88,3493.81,9918.69,9918.69
30,15000,1250020,PERSONAL FUNCIONARIO.,30,1,1,0,0,0,341.75
30,15000,1300000,ADMON. XERAL VIV E URB.  LABORAIS FIXOS. RETRIBUC BÁSICAS,30,1,1,49280.2,0,49280.2,49730.24
30,15000,1300200,ADMON. XERAL VIV E URB.  LAB FIXOS. OUTRAS REMUNER. COMPLEM,30,1,1,45683.52,0,45683.52,45683.52
30,15000,1500000,ADMÓN XERAL VIVENDA E URBANISMO. PRODUTIVIDADE,30,1,1,0,54481.01,54481.01,54481.01
30,15000,1520000,ADMON. XERAL VIV E URB. CARREIRA PROFES/AVALIACIÓN DESEMP,30,1,1,52000,7591.7,59591.7,56013.01
30,15000,1600000,ADMON. XERAL VIV E URB  FUNC. CARREIRA. SEGURIDADE SOCIAL,30,1,1,415616.52,318.98,415935.5,361302.24
30,15000,1600010,ADMON. XERAL VIVENDA E URB  FUNC. INTERINOS. SEG SOCIAL,30,1,1,8848.08,0,8848.08,92307.71
30,15000,1600020,ADMON. XERAL VIV E URB.  FUNC. INTERINOS.PROG ESP. S. SOCIAL,30,1,1,40221.47,20035.62,60257.09,55115.23
30,15000,1600030,ADMON. XERAL VI E URB.  FUNC. INTERINOS.ACUM TAREF. S SOCIAL,30,1,1,5146.85,3402.52,8549.37,8549.37
30,15100,2270600,EDUSI. ESTUDOS E TRABALLOS TÉCNICOS.,30,1,2,40000,160000,200000,0
30,15320,1200330,PAV. DE VÍAS PÚBLICAS. FUNC. INTERINOS ACUM TAREFAS E IT. C1,30,1,1,0,5137.11,5137.11,4131.73
30,15320,1200400,PAVIMENTACIÓN DE VÍAS PÚBLIC. FUNC. CARREIRA. SOLDOS SUBG C2,30,1,1,70129.32,-25000,45129.32,29823.51
30,15320,1200410,PAV. DE VÍAS PÚBLICAS. SOLDOS DO GRUPO C2.,30,1,1,0,18290,18290,12421.59
30,15320,1200600,PAVIMENTACIÓN DE VÍAS PÚBLICAS. FUNC. CARREIRA. . TRIENIOS.,30,1,1,8228.64,0,8228.64,9617.49
30,15320,1210000,PAVIMENTACIÓN DE VÍAS PÚBLICAS. FUNC CARREIRA. COMPL DESTINO,30,1,1,30729,-12000,18729,14882.22
30,15320,1210010,PAV. DE VÍAS PÚBLICAS.FUNC. INTERINOS. COMPL DE DESTINO,30,1,1,0,7450,7450,5316.14
30,15320,1210030,PAV. VÍAS PÚBL. FUNC. INTERINOS. ACUM TAREF E IT. C. DESTINO,30,1,1,0,2038.15,2038.15,1708.97
30,15320,1210100,PAVIMENTAC D VÍAS PÚBLICAS. FUNC. CARREIRA. COMPL ESPECÍFICO,30,1,1,84917.04,-35000,49917.04,40846.06
30,15320,1210110,PAV. DE VÍAS PÚBLICAS.FUNC. INTERINOS VACANTES. COMPL ESPEC,30,1,1,0,22434.5,22434.5,14008.46
30,15320,1210130,PAV. VÍAS PUB.FUNC. INTERINOS. ACUM TAREF E IT. C ESPECÍFICO,30,1,1,0,5234.9,5234.9,4250.14
30,15320,1300000,PAVIMENTAC DE VÍAS PÚBLICAS. LABORAIS FIXOS. RETRIB BÁSICAS,30,1,1,28365.82,544.12,28909.94,17628.44
30,15320,1300200,PAV DE VÍAS PÚBLICAS. LABORAIS FIXOS. OUTRAS REMUNER. COMPL,30,1,1,28455,0,28455,17640.81
30,15320,1310010,RETRIBUCIÓNS PERSOAL LABORAL TEMPORAL COBERTURA RELEVO/VACAN,30,1,1,0,0,0,19354.59
30,15320,1310210,OUTRAS REMUNERACIÓNS. LABORAIS TEMPORAIS RELEVO/VACANTE,30,1,1,0,0,0,21565.46
30,15320,1500000,PAVIMENTACIÓN E VÍAS PÚBLICAS. PRODUTIVIDADE,30,1,1,0,9590.63,9590.63,9590.63
30,15320,1520000,PAVIMENT DE VÍAS PÚBLICAS. CARREIRA PROFES/AVALIACIÓN DESEMP,30,1,1,9000,-3967.84,5032.16,4465.63
30,15320,1600000,PAVIMENTACIÓN DE VÍAS PÚBLICAS. FUNC. CARREIRA. SEG SOCIAL,30,1,1,78320.64,-14828.33,63492.31,49098.9
30,15320,1600010,SEGURIDADE SOCIAL.,30,1,1,0,14451.6,14451.6,28777.58
30,15320,1600030,PAV. VÍAS PÚBLICAS. FUNC INTER. ACUM TAREFSEGURIDADE SOCIAL.,30,1,1,0,3246.66,3246.66,3246.66
30,15320,1620200,PAVIMENTACIÓN DE VÍAS PÚBLICAS. PLUS DE TRANSPORTE,30,1,1,6500,0,6500,1973.87
30,15320,1640000,COMPLEMENTO FAMILIAR DE PERSOAL FUNCIONARIO,30,1,1,0,0,0,3600
30,15321,6090000,EDUSI. INVEST NOVOS EN INFRAEST E BENS USO XERAL,30,1,6,1127482.74,517331.2,1644813.94,1421891.73
30,15321,6190000,EDUSI. OUTROS INVEST. REPOSIC. INFRAEST. E BENS DE USO XRAL.,30,1,6,491032.29,750540.83,1241573.12,611326.48
30,17100,1200300,PARQUES E XARDINS. FUNC. CARREIRA. SOLDOS SUBGRUPO C1,30,1,1,60189.36,0,60189.36,58329.43
30,17100,1200400,PARQUES E XARDINS. FUNC. CARREIRA. SOLDOS SUBGRUPO C2,30,1,1,92072.28,0,92072.28,77495.69
30,17100,1200430,PARQUES E XARDINS.FUNC. INTERINOS. ACUM TAREFAS E IT. SOLDOS,30,1,1,0,3658,3658,2628.4
30,17100,1200600,PARQUES E XARDINS. FUNC. CARREIRA.  TRIENIOS.,30,1,1,33027,0,33027,36651.38
30,17100,1200630,PARQUES E XARDINS.FUNC. INTERINOS.ACUM TAREFAS E IT. TRIENI,30,1,1,0,221.94,221.94,221.94
30,17100,1210000,PARQUES E XARDINS. FUNC. CARREIRA. COMPLEMENTO DE DESTINO,30,1,1,68805,0,68805,63420.62
30,17100,1210030,PARQUES E XARDINS.FUNC. INTER. ACUM TAREF. C.DESTINO,30,1,1,0,1490,1490,1136.57
30,17100,1210100,PARQUES E XARDINS. FUNC. CARREIRA. COMPLEMENTO ESPECÍFICO.,30,1,1,172491.12,0,172491.12,160002.1
30,17100,1210130,PARQUES E XARDINS.FUNC. INTER. ACUM TAREF. C. ESPECÍFICO,30,1,1,0,4486.9,4486.9,2973.28
30,17100,1300000,PARQUES E XARDINS. LABORAIS FIXOS.RETRIBUCIONS BÁSICAS.,30,1,1,27897.42,0,27897.42,28172.54
30,17100,1300200,PARQUES E XARDINS. LABORAIS FIXOS. OUTRAS REMUNER. COMPLEM,30,1,1,28454.88,0,28454.88,28454.88
30,17100,1500000,PARQUES E XARDÍNS. PRODUTIVIDADE,30,1,1,0,19312.69,19312.69,19312.69
30,17100,1520000,PARQUES E XARDINS. CARREIRA PROFESIONAL/AVALIACIÓN DO DESEMP,30,1,1,17000,2833.8,19833.8,17907.68
30,17100,1600000,PARQUES E XARDINS. FUNC. CARREIRA. SEGURIDADE SOCIAL,30,1,1,126549.48,0,126549.48,143198.39
30,17100,1600030,PARQUES E XARDINS.FUNC. INTER. ACUM TAREF. S.SOCIAL,30,1,1,0,2958.26,2958.26,2258.28
30,17100,6090000,EDUSI. INVEST NOVOS EN INFRAESTRUTURAS E BENS DE USO XERAL,30,1,6,80000,20000,100000,0
30,17200,1200000,ADMON. XERAL MEDIO AMBIENTE. FUNC. CARREIRA. SOLDOS SUBG A1,30,1,1,52012.08,0,52012.08,34011.51
30,17200,1200010,ADM. XRAL MEDIO AMBIENTE. FUNC. INTERINOS VACANTES. SOLDO A1,30,1,1,0,0,0,11051.68
30,17200,1200100,ADMON. XERAL MEDIO AMBIENTE. FUNC. CARREIRA. SOLDOS SUBG A2,30,1,1,15608.52,0,15608.52,15112.88
30,17200,1200400,ADMON. XERAL MEDIO AMBIENTE. FUNC. CARREIRA. SOLDOS SUBG C2,30,1,1,10083.24,0,10083.24,0
30,17200,1200600,ADMON. XERAL MEDIO AMBIENTE. FUNC. CARREIRA. TRIENIOS.,30,1,1,12702.6,0,12702.6,13042.74
30,17200,1200610,RETRIBUCIÓNS BÁSICAS FUNCIO.INTERINOS. TRIENIOS.,30,1,1,0,0,0,1540.14
30,17200,1210000,ADMON. XERAL MEDIO AMBIENTE. FUNC. CARREIRA. COMPL DESTINO.,30,1,1,32105.04,0,32105.04,21624.83
30,17200,1210010,A. X. MEDIO AMBIENTE. FUNC. INTERINOS VACANTES. COMP DESTINO,30,1,1,0,0,0,3817.52
30,17200,1210100,ADMON. XERAL MEDIO AMBIENTE. FUNC. CARREIRA.COMPL ESPECÍFICO,30,1,1,92336.4,0,92336.4,66418
30,17200,1210110,A. X. MEDIO AMBIENTE. FUNC. INTERNIOS VACANTES. COMP. ESPEC,30,1,1,0,0,0,9234.05
30,17200,1500000,MEDIO AMBIENTE.PRODUTIVIDADE,30,1,1,0,4920,4920,4920
30,17200,1520000,PARQUES E XARDINS. CARREIRA PROFESIONAL/AVALIACIÓN DO DESEMP,30,1,1,9000,-596.2,8403.8,7841.69
30,17200,1600000,ADMON. XERAL MEDIO AMBIENTE. FUNC. CARREIRA. SEG SOCIAL,30,1,1,54005.64,0,54005.64,40298.29
30,17200,1600010,SEGURIDADE SOCIAL.FUNCIONARIOS INTERINOS,30,1,1,0,0,0,8579.31
30,17210,6090000,EDUSI. INVEST NOVOS EN INFRAESTRUTURAS E BENS DE USO XERAL,30,1,6,52000,13000,65000,0
30,23100,1200000,ASISTENCIA SOCIAL PRIMARIA. FUNC. CARREIRA. SOLDOS SUBG A1,30,2,1,18249.24,0,18249.24,17734.82
30,23100,1200100,ASISTENCIA SOCIAL PRIMARIA. FUNC. CARREIRA. SOLDOS SUBG A2.,30,2,1,14863.2,0,14863.2,0
30,23100,1200120,ASIST SOCIAL PRIMARIA. FUNC. INTERINOS.  PROG ESPECÍFICOS A2,30,2,1,29359.36,78608.91,107968.27,104511.54
30,23100,1200300,ASISTENCIA SOCIAL PRIMARIA. FUNC. CARREIRA. SOLDOS SUBG C1.,30,2,1,23538.12,0,23538.12,19640.73
30,23100,1200320,ASISTENCIA SOCIAL PRIM. FUNC. INTERINOS. PROG ESPECÍFICOS C1,30,2,1,11261.56,179.37,11440.93,10720.86
30,23100,1200400,ASISTENCIA SOCIAL PRIMARIA. FUNC. CARREIRA. SOLDOS SUBG C2,30,2,1,10237.44,0,10237.44,9852.3
30,23100,1200600,ASISTENCIA SOCIAL PRIMARIA. FUNC. CARREIRA. TRIENIOS,30,2,1,10340.52,0,10340.52,12224.57
30,23100,1200620,ASIST SOCIAL PRIM. FUNC. INTERINOS. PROG ESPECÍFIC. TRIENIO,30,2,1,1777.44,8598.07,10375.51,7875.57
30,23100,1210000,ASISTENCIA SOCIAL PRIMARIA. FUNC. CARREIRA. COMPL DE DESTINO,30,2,1,30237.36,0,30237.36,23804.98
30,23100,1210020,ASIST. SOCIAL PRIM. FUNC. INTER. PROG ESPECÍFIC. C. DESTINO,30,2,1,14549.04,27654.16,42203.2,40952.9
30,23100,1210100,ASISTENCIA SOCIAL PRIMARIA. FUNC. CARREIRA. COMPL ESPECÍFICO,30,2,1,80134.68,0,80134.68,63803.52
30,23100,1210120,ASIST SOCIAL PRIM FUNC. INTERINOS. PROG ESPEC. C. ESPECÍFICO,30,2,1,36720.6,68374.12,105094.72,102299.76
30,23100,1250020,PERSONAL FUNCIONARIO.,30,2,1,0,0,0,766.06
30,23100,1300000,ASISTENCIA SOCIAL PRIMARIA. LABORAIS FIXOS. RETRIBUC BÁSICAS,30,2,1,352314.9,0,352314.9,291556.51
30,23100,1300200,ASIST SOCIAL PRIMARIA. LABORAIS FIXOS. OUTRAS REMUNER. COMPL,30,2,1,364116.96,1243.73,365360.69,308877.78
30,23100,1310010,RETRIBUCIÓNS PERSOAL LABORAL TEMPORAL COBERTURA RELEVO/VACAN,30,2,1,0,1300.87,1300.87,55574.62
30,23100,1310210,OUTRAS REMUNERACIÓNS. LABORAIS TEMPORAIS RELEVO/VACANTE,30,2,1,0,0,0,51530.86
30,23100,1500000,ASISTENCIA SOCIAL PRIMARIA. PRODUTIVIDADE,30,2,1,0,35777.84,35777.84,35777.84
30,23100,1520000,ASIST SOCIAL PRIMARIA. CARREIRA PROFESIONAL/AVALIAC DESEMP,30,2,1,30000,11763.52,41763.52,39475.24
30,23100,1600000,ASISTENCIA SOCIAL PRIMARIA. FUNC. CARREIRA. SEG SOCIAL,30,2,1,265518.24,35691.97,301210.21,260978.29
30,23100,1600010,SEGURIDADE SOCIAL.,30,2,1,0,0,0,36774.05
30,23100,1600020,ASIST SOCIAL PRIM. FUNC. INTERINOS. PROG ESPECÍF. S. SOCIAL,30,2,1,29224.44,65023.63,94248.07,90923.49
30,23100,6320000,EDUSI. INV. REPOSICION EDIFICIOS E CONSTRUCC.,30,2,6,24000,96000,120000,0
30,23101,1200010,FUNC. INTERINOS VACANTES. SOLDOS A1,30,2,1,0,0,0,12116.11
30,23101,1200610,UMAD.RETRIBUCIÓNS BÁSICAS FUNCIONARIOS. TRIENIOS.,30,2,1,0,984.91,984.91,984.91
30,23101,1210010,FUNC. INTERINOS VACANTES. COMP DESTINO,30,2,1,0,0,0,4158.93
30,23101,1210110,FUNC. INTERNIOS VACANTES. COMP ESPECÍFIC,30,2,1,0,0,0,10122.65
30,23101,1300000,UMAD. LABORAIS FIXOS. RETRIBUCIÓNS BÁSICAS,30,2,1,317514.98,0,317514.98,271477.34
30,23101,1300200,UMAD. LABORAIS FIXOS. OUTRAS REMUNER. COMPLEMENTAR.,30,2,1,325073.28,0,325073.28,274204.74
30,23101,1310010,RETRIBUCIÓNS PERSOAL LABORAL TEMPORAL COBERTURA RELEVO/VACAN,30,2,1,0,321.22,321.22,19970.72
30,23101,1310210,OUTRAS REMUNERACIÓNS. LABORAIS TEMPORAIS RELEVO/VACANTE,30,2,1,0,0,0,18862.75
30,23101,1500000,UMAD. PRODUTIVIDADE,30,2,1,0,18699.37,18699.37,18699.37
30,23101,1520000,UMAD. CARREIRA PROFESIONAL/AVALIACIÓN DO DESEMPEÑO,30,2,1,25000,1336.14,26336.14,24828.19
30,23101,1600000,UMAD. LABORAIS FIXOS. SEGURIDADE SOCIAL,30,2,1,201033.84,97476.95,298510.79,195782.99
30,23101,1600010,SEGURIDADE SOCIAL.,30,2,1,0,0,0,21967.66
30,23102,1300000,MULLER. LABORAIS FIXOS. RETRIBUCIÓNS BÁSICAS,30,2,1,56848.16,0,56848.16,26093.6
30,23102,1300200,MULLER. LABORAIS FIXOS. RETRIBUCIÓNS COMPLEMENTARIAS,30,2,1,56783.4,0,56783.4,26968.56
30,23102,1310010,RETRIBUCIÓNS PERSOAL LABORAL TEMPORAL COBERTURA RELEVO/VACAN,30,2,1,0,98.12,98.12,9967.42
30,23102,1310210,OUTRAS REMUNERACIÓNS. LABORAIS TEMPORAIS RELEVO/VACANTE,30,2,1,0,0,0,10942.8
30,23102,1500000,MULLER. PRODUTIVIDADE,30,2,1,0,2460,2460,2460
30,23102,1520000,UMAD. CARREIRA PROFESIONAL/AVALIACIÓN DO DESEMPEÑO,30,2,1,6000,-3724.02,2275.98,2180.91
30,23102,1600000,MULLER. LABORAIS FIXOS. SEGURIDADE SOCIAL.,30,2,1,35680.44,30.81,35711.25,19128.74
30,23102,1600010,SEGURIDADE SOCIAL.,30,2,1,0,0,0,7076.35
30,23102,2269900,EDUSI. OUTROS GASTOS DIVERSOS,30,2,2,85305.6,41222.4,126528,0
30,23102,2270600,EDUSI. ESTUDOS E TRABALLOS TÉCNICOS.,30,2,2,7390,29560,36950,0
30,23103,1300000,EMIGRACIÓN/INMIGRACIÓN. LABORAIS FIXOS. RETRIBUCIÓNS BÁSICAS,30,2,1,22408.18,0,22408.18,22410.3
30,23103,1300200,EMIGRACIÓN/INMIGRACIÓN. LABORAIS FIXOS. OUTRAS REMUN. COMPL,30,2,1,22968.48,0,22968.48,22968.36
30,23103,1500000,EMIGRACIÓN/INMIGRACIÓN. PRODUTIVIDADE,30,2,1,0,1230,1230,1230
30,23103,1520000,UMAD. CARREIRA PROFESIONAL/AVALIACIÓN DO DESEMPEÑO,30,2,1,2100,-186.68,1913.32,1847.94
30,23103,1600000,EMIGRACIÓN/INMIGRACIÓN. LABORAIS FIXOS. SEGURIDADE SOCIAL,30,2,1,14248.44,0,14248.44,15722.05
30,24100,1200300,FOMENTO DO EMPREGO. FUNC. CARREIRA. SOLDOS SUBGRUPO C1,30,2,1,11932.56,0,11932.56,11584.3
30,24100,1200600,FOMENTO DO EMPREGO. FUNC. CARREIRA. TRIENIOS,30,2,1,2152.32,0,2152.32,2501.98
30,24100,1210000,FOMENTO DO EMPREGO. FUNC. CARREIRA. COMPLEMENTO DE DESTINO,30,2,1,5141.4,0,5141.4,5141.52
30,24100,1210100,FOMENTO DO EMPREGO. FUNC. CARREIRA. COMPLEMENTO ESPECÍFICO,30,2,1,12668.88,0,12668.88,12668.88
30,24100,1300000,FOMENTO DO EMPREGO. LABORAIS FIXOS. RETRIBUCIÓNS BÁSICAS,30,2,1,38200.7,0,38200.7,38203.68
30,24100,1300200,FOM DO EMPREGO. LABORAIS FIXOS. OUTRAS REMUNER. COMPL,30,2,1,38968.56,0,38968.56,38968.68
30,24100,1310000,FOMENTO DO EMPREGO. LABORAIS TEMP. RETRIB. BÁSICAS,30,2,1,16702.4,0,16702.4,16470.48
30,24100,1310200,FOMENTO DO EMPREGO. LABORAIS TEMP. RETRIB. COMPLEMENTAR.,30,2,1,16177,0,16177,15952.4
30,24100,1310400,FOMENTO DO EMPREGO. PERSOAL RISGA,30,2,1,49910.61,138290.21,188200.82,182658.59
30,24100,1310500,FOMENTO DO EMPREGO. PERSOAL SOCORRISTAS,30,2,1,678.48,4783.9,5462.38,5462.36
30,24100,1310600,FOMENTO DO EMPREGO. PERSOAL MUVIO,30,2,1,164254.99,0,164254.99,158874.42
30,24100,1500000,FOMENTO DO EMPREGO. PRODUTIVIDADE,30,2,1,0,3690,3690,3690
30,24100,1520000,FOMENTO DO EMPREGO. CARREIRA PROFESIONAL/AVALIAC DESEMP,30,2,1,5000,-185.32,4814.68,4511.84
30,24100,1600000,FOMENTO DO EMPREGO. FUNC. CARREIRA. SEGURIDADE SOCIAL,30,2,1,110674.44,46931.25,157605.69,160813.36
30,24100,2270600,EDUSI. ESTUDOS E TRABALLOS TÉCNICOS.,30,2,2,10352.91,-384.48,9968.43,0
30,24101,1200120,PROGRAMA EMPREGO-EDUSI. FUNC. INTERINOS. PROG ESPECÍFICOS A2,30,2,1,29259.84,268.66,29528.5,29528.5
30,24101,1200620,PROG EMPREGO-EDUSI. FUNC. INTERI. PROG ESPECÍFICOS. TRIENIOS,30,2,1,2666.16,384.48,3050.64,3050.64
30,24101,1210020,PROG EMPREGO-EDUSI. FUNC. INTERINOS. PROG ESPEC. C. DESTINO,30,2,1,10081.2,201.86,10283.06,10283.04
30,24101,1210120,PROG EMPREGO-EDUSI. FUNC. INTERINOS.PROG ESPEC. C. ESPECÍFIC,30,2,1,25094.52,501.84,25596.36,25596.36
30,24101,1310120,PROG EMPREGO-EDUSI. LABORAIS TEMPORAIS. RETRIB BASICAS,30,2,1,17933.49,0,17933.49,0
30,24101,1310320,PROGRAMA EMPREGO-EDUSI. LABORAIS TEMPORAIS. VARIABLES,30,2,1,118400.04,0,118400.04,0
30,24101,1500000,PROG. EMPREGO. EDUSI. PRODUTIVIDADE,30,2,1,0,2460,2460,2460
30,24101,1520000,PROGR. EMPREGO. EDUSI. CARREIRA PROFESIONAL/AVALIAC DESEMP,30,2,1,0,3826.64,3826.64,3613.69
30,24101,1600020,PROG EMPREGO-EDUSI. PROG ESPECÍFICOS. SEGURIDADE SOCIAL,30,2,1,72581.36,1247.05,73828.41,22294.33
30,24102,1310100,FOMENTO DO EMPREGO. OBRADOIROS. PERSOAL DIRECTIVO E DOCENTE,30,2,1,78725.01,57628.5,136353.51,135835.54
30,24102,1310300,FOMENTO DO EMPREGO. OBRADOIROS. ALUMNOS-TRABALLADORES,30,2,1,196140,162046.46,358186.46,360083.71
30,24102,1600000,FOMENTO DO EMPREGO. OBRADOIROS. SEGURIDADE SOCIAL,30,2,1,50242.59,41281.25,91523.84,84726.74
30,31100,1200300,PROTEC  SALUBRIDADE PÚBLICA. FUNC. CARREIRA. SOLDOS SUBGR C1,30,3,1,12252.36,0,12252.36,5059.49
30,31100,1200400,PROT DA SALUBRIDADE PÚBLICA. FUNC. CARREIRA. SOLDOS SUBG C2,30,3,1,30221.88,0,30221.88,19704.6
30,31100,1200600,PROTECCIÓN DA SALUBRIDADE PÚBLICA. FUNC. CARREIRA. TRIENIOS,30,3,1,8508.84,0,8508.84,7424.02
30,31100,1210000,PROTECCIÓN D SALUB PÚBLICA. FUNC. CARREIRA. COMPL DE DESTINO,30,3,1,18812.88,0,18812.88,11500.43
30,31100,1210100,PROTECC DA SALUBR PÚBLICA. FUNC. CARREIRA. COMPL ESPECÍFICO,30,3,1,50875.08,0,50875.08,30530.78
30,31100,1500000,PROTECCIÓN DA SALUBRIDADE PÚBLICA.PRODUTIVIDADE,30,3,1,0,2460,2460,2460
30,31100,1520000,PROT DA SALUBRIDADE PÚBL. CARREIRA PROFESIONAL/AVALIA DESEMP,30,3,1,5000,-2483.92,2516.08,2346.32
30,31100,1600000,PROTECC DA SALUBRIDADE PÚBLICA. FUNC. CARREIRA. SEG SOCIAL,30,3,1,29834.88,0,29834.88,21717.59
30,32000,1200000,ADMÓN XERAL EDUCACIÓN. FUNC. CARREIRA. SOLDOS SUBG A1,30,3,1,16882.44,0,16882.44,0
30,32000,1200010,ADMÓN XERAL EDUCACIÓN. FUNC. INTERINOS VACANTES. SOLDOS A1,30,3,1,0,0,0,10250.4
30,32000,1200020,ADMON. XERAL EDUCACIÓN. FUNC. INTERINOS. PROG ESPECÍFICOS A1,30,3,1,4291.21,85.83,4377.04,4377.04
30,32000,1200030,ADMON. XERAL EDUC. FUNC. INTERINOS. ACUM TAREFAS A1,30,3,1,0,4924.05,4924.05,4220.62
30,32000,1200330,ADMON. XERAL EDUC. FUNC. INTERINOS. ACUM TAREFAS C1,30,3,1,0,3350.31,3350.31,2695.88
30,32000,1200610,RETRIBUCIÓNS BÁSICAS FUNCIO.INTERINOS TRIENIOS.,30,3,1,0,0,0,389.08
30,32000,1210000,ADMÓN XERAL EDUCACIÓN. FUNC. CARREIRA. COMPL DE DESTINO,30,3,1,5726.16,0,5726.16,0
30,32000,1210010,ADMÓN XERAL EDUCACIÓN. FUNC. INTERINOS VACANTES. COMPL DESTI,30,3,1,0,0,0,3419.22
30,32000,1210020,ADMÓN XERAL EDUCACIÓN. FUNC. INTERIN. PROG ESPEC. C. DESTINO,30,3,1,1387.89,27.77,1415.66,1415.66
30,32000,1210030,ADMÓN XERAL EDUC. FUNC. INTERINOS. AC TAREFAS E IT. C. DESTI,30,3,1,0,2999.33,2999.33,2570.88
30,32000,1210100,ADMÓN XERAL EDUCACIÓN. FUNC. CARREIRA. COMPL ESPECÍFICO,30,3,1,14103,0,14103,0
30,32000,1210110,ADMÓN XERAL EDUCACIÓN. FUNC. INTERINOS VACANTES. COMPL ESPEC,30,3,1,0,0,0,8561.1
30,32000,1210120,ADMÓN XERAL EDUC. FUNC. INTERINOS. PROG ESPEC. C. ESPECÍFICO,30,3,1,3582.79,71.65,3654.44,3654.44
30,32000,1210130,ADMÓN XERAL EDUC. FUNC. INTERINOS. ACUM TAREFAS E IT. C. ESP,30,3,1,0,7527.46,7527.46,6312.69
30,32000,1300000,ADMÓN XERAL EDUCACIÓN. LABORAIS FIXOS. RETRIBUC BÁSICAS,30,3,1,25292.98,0,25292.98,25294.4
30,32000,1300200,ADMÓN XERAL EDUCACIÓN. LABORAIS FIXOS. OUTRAS REMUNER. COMPL,30,3,1,23094.6,0,23094.6,23094.6
30,32000,1500000,ADMON XRAL EDUCACIÓN. COMPLEMENTO PRODUCTIVIDADE FUNCIONARIO,30,3,1,0,4874.92,4874.92,4874.92
30,32000,1520000,ADMÓN XERAL EDUCACIÓN. CARREIRA PROF/AVALIAC DO DESEMPEÑO,30,3,1,5000,-2795.88,2204.12,2126.14
30,32000,1600000,ADMINISTRACIÓN XERAL EDUCACIÓN. FUNC. CARREIRA. SEG SOCIAL,30,3,1,24628.56,0,24628.56,17430.34
30,32000,1600010,SEGURIDADE SOCIAL.FUNCIONARIOS INTERINOS,30,3,1,0,0,0,8738.41
30,32000,1600020,ADMÓN XERAL EDUCACIÓN. FUNC. INTERINOS. PROG ESPEC. S SOCIAL,30,3,1,2776.17,941.4,3717.57,3147.06
30,32000,1600030,ADMÓN XERAL EDUC. FUNC. INTERINOS. ACUM TAREFAS E IT. S. SOC,30,3,1,0,5124.74,5124.74,5124.74
30,33400,1200000,PROMOCIÓN CULTURAL. FUNC. CARREIRA. SOLDOS SUBGRUPO A1,30,3,1,17320.56,0,17320.56,17034.72
30,33400,1200600,PROMOCIÓN CULTURAL. FUNC. CARREIRA.  TRIENIOS.,30,3,1,2778.48,0,2778.48,3492.84
30,33400,1210000,PROMOCIÓN CULTURAL. FUNC. CARREIRA. COMPLEM DESTINO,30,3,1,6639.48,0,6639.48,6639.6
30,33400,1210100,PROMOCIÓN CULTURAL. FUNC. CARREIRA. COMPLEM ESPECÍFICO,30,3,1,19197.6,0,19197.6,19197.5
30,33400,1500000,PROMOCIÓN CULTURAL. PRODUTIVIDADE,30,3,1,0,1230,1230,1230
30,33400,1520000,PROMOCIÓN CULTURAL. CARREIRA PROF/AVALIAC DO DESEMPEÑO,30,3,1,2400,-195.88,2204.12,2126.14
30,33400,1600000,PROMOCIÓN CULTURAL. FUNC. CARREIRA. SEGURIDADE SOCIAL.,30,3,1,11805.6,0,11805.6,13070.82
30,33401,1200100,BANDA DE MUSICA. FUNC. CARREIRA. SOLDOS SUBGRUPO A2,30,3,1,353016.84,0,353016.84,284879.48
30,33401,1200110,BANDA DE MUSICA. FUNC. INTERINOS. SOLDOS SUBGRUPO A2,30,3,1,14625.68,0,14625.68,59452.8
30,33401,1200120,BANDA DE MUSICA. FUNC. INTERINOS. PROGRAMAS ESPECÍFICOS A2,30,3,1,58286.72,-25038.92,33247.8,26623.67
30,33401,1200130,BANDA MUSICA. FUNC. INTERINOS. ACUM TAREFAS E IT. SOLDOS A2,30,3,1,0,1335.72,1335.72,445.24
30,33401,1200300,BANDA DE MUSICA. FUNC. CARREIRA. SOLDOS SUBGRUPO C1,30,3,1,59540.52,0,59540.52,56506.83
30,33401,1200310,BANDA DE MUSICA. FUNC. INTERINOS. SOLDOS SUBGRUPO C1,30,3,1,11261.56,-11261.56,0,0
30,33401,1200330,FUNC. INTERINOS ACUM TAREFAS E IT. SOLDOS C1,30,3,1,0,24037.45,24037.45,12460.03
30,33401,1200600,BANDA DE MUSICA. FUNC. CARREIRA. TRIENIOS,30,3,1,78308.64,0,78308.64,83602.37
30,33401,1200610,BANDA DE MUSICA. FUNC. INTERINOS. TRIENIOS,30,3,1,444.36,249.63,693.99,5225.28
30,33401,1200620,BANDA DE MUSICA. FUNC. INTERINOS. PROGRAMA. TRIENIOS,30,3,1,0,798.24,798.24,798.24
30,33401,1200630,FUNC. INTERINOS. ACUM TAREFAS E IT. TRIENIOS,30,3,1,0,707.15,707.15,110.46
30,33401,1210000,BANDA DE MUSICA. FUNC. CARREIRA. COMPLEMENTO DE DESTINO,30,3,1,160503.48,0,160503.48,137737.24
30,33401,1210010,BANDA DE MUSICA. FUNC. INTERINOS. COMPLEMENTO DE DESTINO,30,3,1,9508.44,-4467.84,5040.6,20566.08
30,33401,1210020,BANDA  MUSICA. FUNC. INTERINOS. PROG ESPECÍFICOS. C. DESTINO,30,3,1,20162.4,-9750.74,10411.66,9164.03
30,33401,1210030,BANDA  MUSICA. FUNC. INTERINOS. ACUM TAREFAS E IT. C. DESTIN,30,3,1,0,9998.49,9998.49,5097.61
30,33401,1210100,BANDA DE MUSICA. FUNC. CARREIRA. COMPLEMENTO ESPECÍFICO,30,3,1,374812.8,0,374812.8,320922.07
30,33401,1210110,BANDA DE MUSICA. FUNC. INTERINOS. COMPLEMENTO ESPECÍFICO,30,3,1,24098.2,-11575.8,12522.4,51499.28
30,33401,1210120,BANDA DE MUSICA. FUNC. INTERINOS. PROG ESPEC. C. ESPECÍFICO,30,3,1,50489.6,-23816.18,26673.42,23049.94
30,33401,1210130,BANDA  MUSICA. FUNC. INTERINOS. ACUM TAREFAS E IT. C. ESPECÍ,30,3,1,0,25651.41,25651.41,13082.74
30,33401,1300000,BANDA DE MUSICA. LABORAIS FIXOS. RETRIBUCIÓNS BÁSICAS,30,3,1,84213.42,422.64,84636.06,63985.17
30,33401,1300200,BANDA DE MUSICA. LABORAIS FIXOS. OUTRAS REMUNER. COMPLEMENT,30,3,1,99100.44,0,99100.44,61892.65
30,33401,1310030,BANDA DE MÚSICA. LAB. TEMP. ACUM TAREFAS. RETRIB BÁSICAS,30,3,1,0,738.81,738.81,738.81
30,33401,1310230,BANDA DE MÚSICA. LAB TEMP. ACUM TAREFAS. RETRIB COMPLEMENTAR,30,3,1,0,867.1,867.1,867.1
30,33401,1500000,BANDA DE MÚSICA. PRODUTIVIDADE,30,3,1,0,44897.35,44897.35,44897.35
30,33401,1520000,BANDA DE MUSICA. CARREIRA PROFESIONAL/AVALIACIÓN DO DESEMP,30,3,1,50000,8223.99,58223.99,53525.99
30,33401,1600000,BANDA DE MUSICA. FUNC. CARREIRA. SEGURIDADE SOCIAL,30,3,1,319860.6,133468.56,453329.16,445404.7
30,33401,1600010,BANDA DE MUSICA. FUNC. INTERINOS. SEGURIDADE SOCIAL,30,3,1,18790.8,-8528.88,10261.92,45422.08
30,33401,1600020,BANDA DE MUSICA. FUNC. INTERINOS. PROG ESPECÍFICOS. S SOCIAL,30,3,1,40422.24,-17285.66,23136.58,20822.77
30,33401,1600030,SEGURIDADE SOCIAL.,30,3,1,0,22424.32,22424.32,11235.68
30,33401,1640000,COMPLEMENTO FAMILIAR DE PERSOAL FUNCIONARIO,30,3,1,0,0,0,3000
30,33402,1200020,NORMALIZACIÓN LINGUIST. FUNC. INTERINOS. PROG ESPECÍFICOS A1,30,3,1,16663.52,262.54,16926.06,16898.31
30,33402,1200620,NOR LINGUISTICA. FUNC. INTERINOS. PROG ESPECÍFICOS. TRIENIOS,30,3,1,1089.84,137.42,1227.26,1227.26
30,33402,1210020,NORM. LINGUISTICA. FUNC. INTERINOS. PROG ESPECÍF. C. DESTINO,30,3,1,5613.96,118.59,5732.55,5732.55
30,33402,1210120,NORM LINGUISTICA. FUNC. INTERINOS. PROG ESPEC. C. ESPECÍFICO,30,3,1,13826.4,289.73,14116.13,14116.13
30,33402,1300000,NORM LINGUISTICA. LABORAIS FIXOS. RETRIBUCIÓNS BÁSICAS,30,3,1,25517.7,0,25517.7,26132
30,33402,1300200,NORM LINGUISTICA. LABORAIS FIXOS. OUTRAS REMUNER. COMPLEMENT,30,3,1,28120.08,0,28120.08,28120.2
30,33402,1500000,NORMALIZACIÓN LINGUÍSTICA. PRODUTIVIDADE,30,3,1,0,2460,2460,2460
30,33402,1520000,NORMALIZAC LINGUISTICA. CARREIRA PROFESIONAL/AVALIAC DESEMP,30,3,1,2400,2008.24,4408.24,4215.75
30,33402,1600000,NORMALIZACIÓN LINGUISTICA. LABORAIS FIXOS. SEGURIDADE SOCIAL,30,3,1,15681.24,0,15681.24,17605.98
30,33402,1600020,NORM LINGUISTICA. FUNC. INTERINOS. PROG ESPECÍF. SEG. SOCIAL,30,3,1,11604.6,1629.13,13233.73,12640.8
30,33403,1300000,CENTROS SOCIOCULTURAIS. LABORAIS FIXOS. RETRIBUCIÓNS BÁSICAS,30,3,1,388227.74,5060.94,393288.68,376118.81
30,33403,1300200,CENTROS SC. LABORAIS FIXOS. OUTRAS REMUNER. COMPLEM,30,3,1,420937.08,0,420937.08,394020.43
30,33403,1310010,RETRIBUCIÓNS PERSOAL LABORAL TEMPORAL COBERTURA RELEVO/VACAN,30,3,1,0,0,0,345.4
30,33403,1310030,CSC. LAB TEMP. ACUM TAREFAS. RETRIB BÁSICAS,30,3,1,0,8588.94,8588.94,6764.87
30,33403,1310210,OUTRAS REMUNERACIÓNS. LABORAIS TEMPORAIS RELEVO/VACANTE,30,3,1,0,0,0,405.37
30,33403,1310230,CSC. LAB TEMP . ACUM TAREFAS. RETRIB COMPLEMENTARIAS,30,3,1,0,10192.55,10192.55,8161.11
30,33403,1500000,CENTROS SOCIOCULTURAIS. PRODUTIVIDADE,30,3,1,0,28716.81,28716.81,28716.81
30,33403,1520000,CENTROS SOCIOCULTURAIS. CARREIRA PROFESIONAL/AAVALIAC DESEMP,30,3,1,30000,4088.48,34088.48,31619.64
30,33403,1600000,CENTROS SOCIOCULTURAIS. LABORAIS FIXOS. SEGURIDADE SOCIAL,30,3,1,254286.96,1650.3,255937.26,293259.74
30,33403,1600010,SEGURIDADE SOCIAL.,30,3,1,0,0,0,385.87
30,33403,1600030,CSC. LAB. TEMP. ACUM TAREFAS. SEGURIDADE SOCIAL,30,3,1,0,5377.41,5377.41,4623.46
30,33403,2270000,CSC. LIMPEZA E ASEO.,30,3,2,456398.19,0,456398.19,319168.59
30,33404,1200300,P. CULTURAL. AA.VECIÑAIS. FUNC. CARREIRA. SOLDOS SUBGR C1,30,3,1,24166.56,0,24166.56,23266.06
30,33404,1200600,P. CULTURAL. ASOCIACION VECIÑAIS. FUNC. CARREIRA. TRIENIOS,30,3,1,5982.36,0,5982.36,7642.33
30,33404,1210000,P. CULTURAL. AA. VECIÑAIS. FUNC. CARREIRA. COMPL DE DESTINO,30,3,1,10867.56,0,10867.56,10867.8
30,33404,1210100,P. CULTURAL. AA. VECIÑAIS. FUNC. CARREIRA. COMPL ESPECÍFICO,30,3,1,26771.88,0,26771.88,26771.78
