#Org.,Prog.,Econ.,Denominación,Vinc. Org.,Vinc. Fun.,Vinc. Eco.,Créditos Iniciales,Modificaciones de Crédito,Créditos Definitivos,Obligaciones Reconocidas,,,,,,,,,,
030,33403,13102,CENTROS SOCIOCULTURAIS. O. REMUNERACIÓNS. LABORAIS TEMPORAIS,030,3,1,64656.12,0,64656.12,68161.67,,,,,,,,,,
030,33403,13500,CENTROS SOCIOCULTURAIS. O. RETRIBUCIONS. PROMOCION INTERNA,030,3,1,20974.88,0,20974.88,0,,,,,,,,,,
030,33403,16000,CENTROS SOCIOCULTURAIS. SEGURIDAD SOCIAL.,030,3,1,204719.28,0,204719.28,212865.17,,,,,,,,,,
030,33403,22700,CSC. LIMPEZA E ASEO.,030,3,2,288071.13,1582.68,289653.81,279156.84,,,,,,,,,,
030,33404,12003,P. CULTURAL. ASOC. VECIÑAIS .SUELDOS DEL GRUPO C1.,030,3,1,23170.56,0,23170.56,22082.75,,,,,,,,,,
030,33404,12006,P. CULTURAL. ASOCIACIONS VECIÑAS. TRIENIOS.,030,3,1,5732.76,0,5732.76,6531.67,,,,,,,,,,
030,33404,12100,P.CULTURAL AA VV. COMPLEMENTO DE DESTINO.,030,3,1,10419.6,0,10419.6,10294.3,,,,,,,,,,
030,33404,12101,P.CULTURAL.AA.VV. COMPLEMENTO ESPECÍFICO,030,3,1,25669.68,0,25669.68,25390.97,,,,,,,,,,
030,33404,16000,PROMOCION CULTURAL ASOC. VECIÑAIS. .SEGURIDAD SOCIAL.,030,3,1,16521.84,0,16521.84,16678.28,,,,,,,,,,
030,33600,12000,CASCO HISTORICO.SUELDOS DEL GRUPO A1.,030,3,1,133195.08,0,133195.08,128454.11,,,,,,,,,,
030,33600,12001,CASCO HISTÓRICO. SOLDOS DO GRUPO A2.,030,3,1,14250.96,0,14250.96,14198.66,,,,,,,,,,
030,33600,12003,CASCO HISTORICO. SUELDOS DEL GRUPO C1.,030,3,1,11470.32,0,11470.32,11066.26,,,,,,,,,,
030,33600,12004,CASCO HISTORICO. SUELDOS DEL GRUPO C2.,030,3,1,28059.12,0,28059.12,9318.54,,,,,,,,,,
030,33600,12006,CASCO HISTORICO. TRIENIOS.,030,3,1,18643.92,0,18643.92,23378.91,,,,,,,,,,
030,33600,12100,CASCO HISTORICO. COMPLEMENTO DE DESTINO.,030,3,1,77225.16,0,77225.16,67102.48,,,,,,,,,,
030,33600,12101,CASCO HISTÓRICO. COMPLEMENTO ESPECÍFICO.,030,3,1,218737.2,85558.02,304295.22,257819.8,,,,,,,,,,
030,33600,13000,CASCO HISTÓRICO. RETRIBUCIONS BÁSICAS.,030,3,1,11726.56,0,11726.56,11747.74,,,,,,,,,,
030,33600,13002,CASCO HISTORICO. RETRIBUCIONS COMPLEMENTARIAS,030,3,1,13360.56,0,13360.56,13117.8,,,,,,,,,,
030,33600,16000,CASCO HISTORICO.SEGURIDAD SOCIAL.,030,3,1,133780.68,24584.67,158365.35,143260.29,,,,,,,,,,
030,33600,60900,PROTECC PATRIMONIO HCO ARTÍSTICO. INVEST NOVOS EN IFEBUX,030,3,6,90000,119319.22,209319.22,0,,,,,,,,,,
030,33600,60902,OTRAS INVERS NUEVAS EN INFRAEST Y BIENES DEST AL USO GRAL,030,3,6,0,12000,12000,0,,,,,,,,,,
030,33600,61900,PROTECC PATRIMONIO HCO-ARTÍSTICO. INVEST NOVOS EN IEBUX,030,3,6,125000,0,125000,0,,,,,,,,,,
030,33800,12003,FESTEXOS. SUELDOS DEL GRUPO C1.,030,3,1,11626.44,0,11626.44,11159.38,,,,,,,,,,
030,33800,12004,FESTEXOS. SUELDOS DEL GRUPO C2.,030,3,1,9778.68,0,9778.68,2244.2,,,,,,,,,,
030,33800,12006,FESTEXOS. TRIENIOS.,030,3,1,4970.4,0,4970.4,4242.61,,,,,,,,,,
030,33800,12100,FESTEXOS. COMPLEMENTO DE DESTINO.,030,3,1,9859.56,0,9859.56,6433.96,,,,,,,,,,
030,33800,12101,FESTEXOS. COMPLEMENTO ESPECÍFICO.,030,3,1,24339.72,0,24339.72,15984.99,,,,,,,,,,
030,33800,16000,FESTEXOS.SEGURIDAD SOCIAL.,030,3,1,14493.24,0,14493.24,21897.06,,,,,,,,,,
030,34000,12000,PROMOCION E FOMENTO DO DEPORTE. SOLDO GRUPO A1.,030,3,1,0,0,0,8793.52,,,,,,,,,,
030,34000,12003,PROMOCION E FOMENTO DO DEPORTE. SUELDOS DEL GRUPO C1.,030,3,1,11370,0,11370,11112.88,,,,,,,,,,
030,34000,12004,PROMOCIÓN E FOMENTO DO DEPORTE. SOLDOS DO GRUPO C2,030,3,1,0,4584.78,4584.78,3655.09,,,,,,,,,,
030,34000,12006,PROMOCION E FOMENTO DO DEPORTE. TRIENIOS.,030,3,1,1761.84,0,1761.84,2269.13,,,,,,,,,,
030,34000,12100,PROMOCION E FOMENTO DO DEPORTE. COMPLEMENTO DE DESTINO.,030,3,1,4929.36,1866.96,6796.32,9477.09,,,,,,,,,,
030,34000,12101,PROMOCIÓN E FOMENTO DO DEPORTE.COMPLEMENTO ESPECÍFICO.,030,3,1,12147.36,5096.52,17243.88,23614.82,,,,,,,,,,
030,34000,13000,PROMOCIÓN E FOMENTO DO DEPORTE. RETRIBUCIONS BÁSICAS.,030,3,1,131253.08,0,131253.08,117941.54,,,,,,,,,,
030,34000,13002,PROMOCION E FOMENTO DEPORTE. RETRIBUCIONS COMPLEMENTARIAS,030,3,1,143483.16,0,143483.16,130725.99,,,,,,,,,,
030,34000,13100,RETRIBUCIÓNS PERSOAL LABORAL TEMPORAL,030,3,1,623.54,0,623.54,4939.85,,,,,,,,,,
030,34000,13102,OUTRAS REMUNERACIÓNS. LABORAIS TEMPORAIS,030,3,1,1136.83,0,1136.83,7140.1,,,,,,,,,,
030,34000,16000,PRMOCION E FOMENTO DO DEPORTE. SEGURIDAD SOCIAL.,030,3,1,94302.3,2910.18,97212.48,108469.39,,,,,,,,,,
030,34200,22700,INSTALACIÓNS DEPORTIVAS. LIMPEZA E ASEO,030,3,2,194445.39,0,194445.39,173246.52,,,,,,,,,,
030,43120,13000,MERCADOS. RETRIBUCIONS BÁSICAS.,030,4,1,13075.92,0,13075.92,5904.84,,,,,,,,,,
030,43120,13002,MERCADOS. RETRIBUCIONS COMPLEMENTARIAS,030,4,1,13641.36,0,13641.36,4472.83,,,,,,,,,,
030,43120,16000,MERCADO. SEGURIDAD SOCIAL.,030,4,1,8255.76,0,8255.76,6868.32,,,,,,,,,,
030,43300,12000,DESENVOLVEMENTO EMPRESARIAL.SUELDOS DEL GRUPO A1.,030,4,1,33049.68,12785,45834.68,38544.99,,,,,,,,,,
030,43300,12006,DESENVOLVEMENTO EMPRESARIAL. TRIENIOS.,030,4,1,3728.76,3420,7148.76,9005.45,,,,,,,,,,
030,43300,12100,DESENVOLVEMENTO EMPRESARIAL.COMPLEMENTO DE DESTINO,030,4,1,12731.76,7770,20501.76,15954.23,,,,,,,,,,
030,43300,12101,DESENVOLVEMENTO EMPRESARIAL. COMPLEMENTO ESPECÍFICO.,030,4,1,36814.32,7817.26,44631.58,46956.57,,,,,,,,,,
030,43300,13000,DESENVOLVEMENTO EMPRESARIAL. RETRIBUCIÓNS BÁSICAS,030,4,1,40214.96,0,40214.96,32537.62,,,,,,,,,,
030,43300,13002,DESENVOLVEMENTO EMPRESARIAL. RETRIBUCIONS COMPLEMENTARIAS,030,4,1,44045.04,0,44045.04,62491.57,,,,,,,,,,
030,43300,16000,DESENVOLVEMENTO EMPRESARIAL. SEGURIDAD SOCIAL.,030,4,1,50147.64,0,50147.64,52302.65,,,,,,,,,,
030,43300,22699,DESENVOLVEMENTO EMPRESARIAL. OUTROS GASTOS DIVERSOS,030,4,2,365292.45,58240,423532.45,0,,,,,,,,,,
030,49300,12003,OMIC. SUELDOS DEL GRUPO C1.,030,4,1,11819.4,0,11819.4,11304.8,,,,,,,,,,
030,49300,12006,OMIC. TRIENIOS.,030,4,1,3286.44,0,3286.44,3746.8,,,,,,,,,,
030,49300,12100,OMIC.COMPLEMENTO DE DESTINO.,030,4,1,6365.88,0,6365.88,6342.66,,,,,,,,,,
030,49300,12101,OMIC. COMPLEMENTO ESPECÍFICO.,030,4,1,18068.28,0,18068.28,18001.76,,,,,,,,,,
030,49300,13000,OMIC. RETRIBUCIONS BÁSICAS.,030,4,1,3399.34,0,3399.34,3275.65,,,,,,,,,,
030,49300,13002,OMIC. RETRIBUCIONS COMPLEMENTARIAS,030,4,1,3410.28,0,3410.28,3241.52,,,,,,,,,,
030,49300,13100,RETRIBUCIÓNS PERSOAL LABORAL TEMPORAL,030,4,1,8128.72,0,8128.72,8076.3,,,,,,,,,,
030,49300,13102,OUTRAS REMUNERACIÓNS. LABORAIS TEMPORAIS,030,4,1,9540.12,0,9540.12,9478.76,,,,,,,,,,
030,49300,16000,OMIC. SEGURIDADE SOCIAL.,030,4,1,17024.52,0,17024.52,17384.36,,,,,,,,,,
030,91200,10000,ORGANOS DE GOBERNO. RETRIBUCIONES BÁSICAS.,030,9,1,338679.86,0,338679.86,331860.38,,,,,,,,,,
030,91200,10001,ORGANOS DE GOBERNO.RETRIBUCIÓNS COMPLEMENTARIAS,030,9,1,411444.24,0,411444.24,406949.09,,,,,,,,,,
030,91200,11000,ORGANOS DE GOBERNO.RETRIBUCIONES BÁSICAS.,030,9,1,259823.92,1549.23,261373.15,255585.21,,,,,,,,,,
030,91200,11001,ORGANOS DE GOBERNO. RETRIBUCIONES COMPLEMENTARIAS.,030,9,1,316815.48,1809.1,318624.58,386201.64,,,,,,,,,,
030,91200,12003,ORGANOS DE GOBERNO. SUELDOS DEL GRUPO C1.,030,9,1,11584.8,0,11584.8,12869.06,,,,,,,,,,
030,91200,12004,ORGANOS DE GOBERNO. SUELDOS DEL GRUPO C2.,030,9,1,38748.36,0,38748.36,26676.81,,,,,,,,,,
030,91200,12006,ORGANOS DE GOBERNO. TRIENIOS.,030,9,1,7515.12,0,7515.12,8983.18,,,,,,,,,,
030,91200,12100,ORGANOS DE GOBIERNO.COMPLEMENTO DE DESTINO.,030,9,1,23807.04,0,23807.04,19046.85,,,,,,,,,,
030,91200,12101,ÓRGANOS DE GOBERNO. COMPLEMENTO ESPECÍFICO.,030,9,1,68602.8,0,68602.8,55364.33,,,,,,,,,,
030,91200,16000,ORGANOS DE GOBERNO. SEGURIDAD SOCIAL.,030,9,1,393237.48,1078.03,394315.51,386033.37,,,,,,,,,,
030,91200,22602,ÓRGANOS DE GOBERNO. PUBLICIDADE E PROPAGANDA.,030,9,2,20000,25164.32,45164.32,31828.82,,,,,,,,,,
030,91200,22699,ÓRGANOS DE GOBERNO . OUTROS GASTOS DIVERSOS,030,9,2,10000,0,10000,11.91,,,,,,,,,,
030,91200,22706,ÓRGANOS DE GOBERNO. ESTUDOS E TRABALLOS TÉCNICOS,030,9,2,1000,6737.28,7737.28,6737.28,,,,,,,,,,
030,91200,23000,ÓRGANOS DE GOBERNO. AXUDAS CUSTE DOS MEMBROS ÓRGANOS DE GOB,030,9,2,4000,0,4000,1294.21,,,,,,,,,,
030,91200,23100,ÓRGANOS DE GOBERNO.LOCOMOCIÓN.DOS MEMBROS ÓRGANOS DO GOBERNO,030,9,2,15000,0,15000,5008.14,,,,,,,,,,
030,91200,23300,ÓRGANOS DE GOBERNO. OUTRAS INDEMNIZACIÓNS,030,9,2,45000,0,45000,36060,,,,,,,,,,
030,91200,48900,ÓRGANOS DE GOBERNO. TRANSFERENCIAS GRUPOS MUNICIPAIS,030,9,4,156700,0,156700,129060,,,,,,,,,,
030,92000,10100,PERSOAL. RETRIBUCIÓNS BÁSICAS.,030,9,1,0,0,0,66540.45,,,,,,,,,,
030,92000,10101,OTRAS REMUNERACIONES.,030,9,1,0,0,0,142972.51,,,,,,,,,,
030,92000,12000,ADMINISTRACION XERAL. SUELDOS DEL GRUPO A1.,030,9,1,206381.88,0,206381.88,122911.49,,,,,,,,,,
030,92000,12001,ADMINISTRACIÓN XERAL.SUELDOS DEL GRUPO A2.,030,9,1,30003.6,0,30003.6,28874.4,,,,,,,,,,
030,92000,12003,ADMINISTRACION XERAL. SUELDOS DEL GRUPO C1.,030,9,1,194588.64,0,194588.64,178327.49,,,,,,,,,,
030,92000,12004,SUELDOS DEL GRUPO C2.,030,9,1,156152.16,0,156152.16,140331.74,,,,,,,,,,
030,92000,12005,ADMINISTRACION XERAL. SOLDOS DEL GRUPO E.,030,9,1,61418.76,0,61418.76,51463.85,,,,,,,,,,
030,92000,12006,ADMINISTRACION XERAL. TRIENIOS.,030,9,1,118109.88,0,118109.88,125885.65,,,,,,,,,,
030,92000,12100,ADMINISTRACION XERAL.COMPLEMENTO DE DESTINO.,030,9,1,311787.96,0,311787.96,245246.67,,,,,,,,,,
030,92000,12101,ADMINISTRACIÓN XERAL. COMPLEMENTO ESPECÍFICO.,030,9,1,862587.36,0,862587.36,666333.57,,,,,,,,,,
030,92000,12104,RETRIBUCIONES COMPLEMENTARIAS. ADECUACIÓN POSTOS DE TRABALLO,030,9,1,50000,0,50000,0,,,,,,,,,,
030,92000,12500,ADMON XERAL.O RETRIBUCIONS.. PROMOCIÓN INTERNA,030,9,1,125301.07,0,125301.07,0,,,,,,,,,,
030,92000,13000,ADMINISTRACIÓN XERAL. RETRIBUCIONS BÁSICAS.,030,9,1,209857.24,0,209857.24,189655.63,,,,,,,,,,
030,92000,13001,LABORAL FIXO. HORAS EXTRAORDINARIAS,030,9,1,0,600.36,600.36,600.36,,,,,,,,,,
030,92000,13002,ADMINISTRACION XERAL.RETRIBUCIONS COMPLEMENTARIAS,030,9,1,199912.68,0,199912.68,312009.63,,,,,,,,,,
030,92000,13100,ADMON XERAL. RETRIBUCIÓNS PERSOAL LABORAL TEMPORAL,030,9,1,114684.18,0,114684.18,117730.29,,,,,,,,,,
030,92000,13101,RETRIBUCIÓNS PERSOAL LABORAL TEMPORAL. OUTROS,030,9,1,100000,0,100000,0,,,,,,,,,,
030,92000,13102,ADMON XERAL.OUTRAS REMUNERACIÓNS. LABORAIS TEMPORAIS,030,9,1,150073.56,0,150073.56,150612.19,,,,,,,,,,
030,92000,13500,ADMINISTRACIÓN XERAL. PERSONAL LABORAL. PROMOCIÓN INTERNA,030,9,1,40008.6,0,40008.6,0,,,,,,,,,,
030,92000,15000,COMPLEMENTO PRODUCTIVIDADE FUNCIONARIOS,030,9,1,456280.03,0,456280.03,626517.91,,,,,,,,,,
030,92000,15100,ADMINISTARCIÓN XERAL. GRATIFICACIONS FUNCIONARIOS,030,9,1,80000,-55070.33,24929.67,24929.67,,,,,,,,,,
030,92000,15300,COMPLEMENTO DEDICACION ESPECIAL,030,9,1,10000,0,10000,0,,,,,,,,,,
030,92000,16000,ADMINISTRACION XERAL. SEGURIDAD SOCIAL.,030,9,1,658300.2,0,658300.2,701590.49,,,,,,,,,,
030,92000,16108,OUTRAS PRESTACIÓNS SOCIAIS,030,9,1,175000,0,175000,436811.2,,,,,,,,,,
030,92000,16200,FORMACIÓN Y PERFECCIONAMIENTO DO PERSOAL.,030,9,1,80000,0,80000,37880.31,,,,,,,,,,
030,92000,16202,TRANSPORTE DE PERSONAL.,030,9,1,11000,-6500,4500,3165.17,,,,,,,,,,
030,92000,16204,ACCIÓN SOCIAL.,030,9,1,450000,0,450000,349226.87,,,,,,,,,,
030,92000,20200,ADMINISTRACIÓN XERAL. ARRENDAMENTOS EDIFICIOS E OUTRAS CONST,030,9,2,144895.45,0,144895.45,120143.19,,,,,,,,,,
030,92000,20400,ADMINISTRACIÓN XERAL. ARRENDAMENTO MATERIAL DE TRANSPORTE,030,9,2,57999.96,4265.66,62265.62,30776.75,,,,,,,,,,
030,92000,21200,ADMINISTRACIÓN XERAL.REPARAC. MANTEM. EDIFICIOS E O.CONSTRUC,030,9,2,86250,0,86250,59021.53,,,,,,,,,,
030,92000,21300,"PARQUE MÓBIL. REPARAC. MANTEM, MAQUIN.,INSTA E UTILLA.",030,9,2,3400,0,3400,2778.3,,,,,,,,,,
030,92000,21400,ADMINISTRACIÓN XERAL. REPARAC. MANTEM. MATERIAL TRANSPORTE,030,9,2,90000,0,90000,59198.66,,,,,,,,,,
030,92000,21600,ADMINISTRACIÓN XERAL. REPARA. MANTEN. EQUIPOS PROCESOS INFO,030,9,2,10000,0,10000,11134.71,,,,,,,,,,
030,92000,22000,ADMINISTRACIÓN XERAL. MAT. ORDINARIO NO INVENTARIABLE.,030,9,2,74506.48,0,74506.48,44830.7,,,,,,,,,,
030,92000,22001,"ADMON. XERAL.PRENSA, REVISTAS E OUTRAS PUBLICACIÓNS.",030,9,2,3200,50.15,3250.15,1684.48,,,,,,,,,,
030,92000,22103,ADMINISTRACIÓN XERAL. COMBUSTIBLES E CARBURANTES.,030,9,2,90000,15974.07,105974.07,104431.3,,,,,,,,,,
030,92000,22104,ADMINISTRACIÓN XERAL. VESTIARIO.,030,9,2,13600,0,13600,8144.7,,,,,,,,,,
030,92000,22201,ADMINISTRACIÓN XERAL. CORREO E SERVIZOS URXENTES,030,9,2,300000,551.76,300551.76,467633.54,,,,,,,,,,
030,92000,22401,ADMINISTRACIÓN XERAL. PRIMAS DE SEGUROS.,030,9,2,42000,0,42000,27400,,,,,,,,,,
030,92000,22403,ADMÓN XERAL. PRIMAS SEGUROS. SEG. ACCIDENTES EMPREGADOS PUBL,030,9,2,9504.69,0,9504.69,6329.88,,,,,,,,,,
030,92000,22501,TRIBUTOS DE LAS COMUNIDADES AUTÓNOMAS.,030,9,2,0,0,0,1475.7,,,,,,,,,,
030,92000,22502,TRIBUTOS DE LAS ENTIDADES LOCALES.,030,9,2,12000,0,12000,0,,,,,,,,,,
030,92000,22603,ADMINISTRACIÓN XERAL. PUBLICACIÓN EN DIARIOS OFICIALES.,030,9,2,10000,0,10000,2923.04,,,,,,,,,,
030,92000,22607,ADMINISTRACIÓN XERAL. OPOSICIONS E PROBAS SELECTIVAS,030,9,2,80000,0,80000,0,,,,,,,,,,
030,92000,22699,ADMINISTRACIÓN XERAL. OUTROS GASTOS DIVERSOS,030,9,2,12000,0,12000,372.51,,,,,,,,,,
030,92000,22700,ADMINISTRACIÓN XERAL. LIMPEZA E ASEO.,030,9,2,607032.52,0,607032.52,567919.28,,,,,,,,,,
030,92000,22701,ADMINISTRACIÓN XERAL. SEGURIDADE,030,9,2,6000,341.32,6341.32,5090.74,,,,,,,,,,
030,92000,22706,ADMINISTRACIÓN XERAL. ESTUDOS E TRABALLOS TÉCNICOS,030,9,2,106000,0,106000,56607.17,,,,,,,,,,
030,92000,22799,ADMINISTRACIÓN XERAL. OUTROS TRABALLOS REALIZADOS POR EEP,030,9,2,0,0,0,525,,,,,,,,,,
030,92000,23010,DIETAS. ADMINISTRACIÓN XERAL .DEL PERSONAL DIRECTIVO.,030,9,2,0,0,0,881.73,,,,,,,,,,
030,92000,23020,ADMINISTRACIÓN XERAL.AXUDAS DE CUSTE PERSOAL NON DIRECTIVO.,030,9,2,10000,0,10000,6442.27,,,,,,,,,,
030,92000,23110,LOCOMOCIÓN. ADMINISTRACION XERAL.DEL PERSONAL DIRECTIVO.,030,9,2,0,0,0,2306.91,,,,,,,,,,
030,92000,23120,ADMINISTRACIÓN XERAL. LOCOMOCIÓN. DO PERSOAL NON DIRECTIVO.,030,9,2,25000,0,25000,11037.09,,,,,,,,,,
030,92000,23300,PERSOAL. OUTRAS INDEMNIZACIÓNS,030,9,2,0,0,0,7483.91,,,,,,,,,,
030,92000,35200,PERSOAL. XUROS DE MORA,030,9,3,0,4962.47,4962.47,4962.47,,,,,,,,,,
030,92000,62400,ADMÓN XERAL. ELEMENTOS DE TRANSPORTE,030,9,6,26500,21500,48000,0,,,,,,,,,,
030,92000,62500,ADMINISTRACIÓN XERAL. MOBILIARIO,030,9,6,1500,0,1500,1150,,,,,,,,,,
030,92000,83000,ADMINISTRACIÓN XERAL.ANTICIPOS DE PAGAS O PERSOAL,030,9,8,80000,0,80000,66554.96,,,,,,,,,,
030,92001,12000,INFORMATICA E REFORMA ADMINISTRATIVA.SUELDOS DEL GRUPO A1.,030,9,1,17387.88,0,17387.88,16941.92,,,,,,,,,,
030,92001,12001,INFORMATICA E REFORMA ADMINISTRATIVA.SUELDOS DEL GRUPO A2.,030,9,1,43455.6,0,43455.6,42946.63,,,,,,,,,,
030,92001,12003,INFORMATICA REFORMA ADMINISTRATIVA. SUELDOS DEL GRUPO C1.,030,9,1,57662.64,0,57662.64,55749.6,,,,,,,,,,
030,92001,12006,INFORMATICA E REFORMA ADMINISTRATIVA. TRIENIOS.,030,9,1,16745.4,0,16745.4,22797.72,,,,,,,,,,
030,92001,12100,INFORMATICA REFORMA ADMINISTRATIVACOMPLEMENTO DE DESTINO.,030,9,1,55857.36,0,55857.36,55525.47,,,,,,,,,,
030,92001,12101,INFORMÁTICA E REFORMA ADMINISTRATIVA.COMPLEMENTO ESPECÍFICO.,030,9,1,149961.72,0,149961.72,149130.08,,,,,,,,,,
030,92001,16000,INFORMATICA E REFORMA ADMINISTRATIVA. SEGURIDAD SOCIAL.,030,9,1,84073.92,0,84073.92,85991.65,,,,,,,,,,
030,92001,62600,INFORMÁTICA. EQUIPOS PARA PROCESOS DE INFORMACION,030,9,6,604480,95520,700000,0,,,,,,,,,,
030,92500,12000,ATENCION CIDADA.SUELDOS DEL GRUPO A1.,030,9,1,16923.48,0,16923.48,16424.64,,,,,,,,,,
030,92500,12003,ATENCION CIDADA. SUELDOS DEL GRUPO C1.,030,9,1,22420.68,0,22420.68,10806.39,,,,,,,,,,
030,92500,12004,ATENCION CIDADA. SUELDOS DEL GRUPO C2.,030,9,1,29253.36,0,29253.36,32088.71,,,,,,,,,,
030,92500,12006,ATENCION CIDADA. TRIENIOS.,030,9,1,11782.08,0,11782.08,13656.22,,,,,,,,,,
030,92500,12100,ATENCIÓN CIDADA. COMPLEMENTO DE DESTINO.,030,9,1,29685,0,29685,26021.56,,,,,,,,,,
030,92500,12101,ATENCIÓN CIDADÁ.COMPLEMENTO ESPECÍFICO.,030,9,1,78787.44,0,78787.44,70681.96,,,,,,,,,,
030,92500,16000,ATENCION CIDADA. SEGURIDADE SOCIAL.,030,9,1,44872.56,0,44872.56,46358.92,,,,,,,,,,
030,92500,21600,ATENCIÓN CIDADÁ. REPARA. MANTEN. EQUIPOS PROCESOS INFORM.,030,9,2,1100,17.77,1117.77,1039.03,,,,,,,,,,
030,92501,22602,COMUNICACIÓN. PUBLICIDADE E PROPAGANDA.,030,9,2,25000,0,25000,0,,,,,,,,,,
030,92900,50000,FONDO DE CONTINEXIA E OUTROS IMPREVISTOS,030,9,5,100000,0,100000,0,,,,,,,,,,
030,93100,10100,PERSOAL. RETRIBUCIONES BÁSICAS.,030,9,1,0,0,0,11503.46,,,,,,,,,,
030,93100,10101,PERSOAL. OUTRAS REMUNERACIÓNS,030,9,1,0,0,0,24907.15,,,,,,,,,,
030,93100,12000,POLITICA ECONOMIA E FISCAL.SUELDOS DEL GRUPO A1.,030,9,1,120581.16,0,120581.16,84420.56,,,,,,,,,,
030,93100,12001,POLITICA ECONOMICA E FISCAL.SUELDOS DEL GRUPO A2.,030,9,1,146357.4,0,146357.4,106075.95,,,,,,,,,,
030,93100,12003,POLITICA ECONOMICA E FISCAL. SUELDOS DEL GRUPO C1.,030,9,1,164962.9,0,164962.9,139240.88,,,,,,,,,,
030,93100,12004,POLITICA ECONOMICA E FISCAL. SUELDOS DEL GRUPO C2.,030,9,1,112297.08,4584.78,116881.86,126827.95,,,,,,,,,,
030,93100,12006,POLITICA ECONOMICA E FISCAL. TRIENIOS.,030,9,1,75762.24,0,75762.24,82508.99,,,,,,,,,,
030,93100,12100,POLITICA ECONOMICA E FISCAL.COMPLEMENTO DE DESTINO.,030,9,1,251788.58,1866.96,253655.54,216458.64,,,,,,,,,,
030,93100,12101,POLÍTICA ECONÓMICA E FISCAL. COMPLEMENTO ESPECÍFICO.,030,9,1,669544.44,5096.52,674640.96,579055.8,,,,,,,,,,
030,93100,12500,POLITICA ECONOMICA E FISCAL.O.RETRIBUCION. PROMOCIÓN INTERNA,030,9,1,7234.84,0,7234.84,0,,,,,,,,,,
030,93100,13000,POLÍTICA ECONÓMICA E FISCAL. RETRIBUCIONS BÁSICAS.,030,9,1,117197.52,0,117197.52,116801.47,,,,,,,,,,
030,93100,13002,POLITICIA ECONOMICA E FISCAL. RETRIBUCIONS COMPLEMENTARIAS,030,9,1,122285.16,0,122285.16,121850.54,,,,,,,,,,
030,93100,13100,P FISCAL E ECONOMICA. RETRIBUCIÓNS PERSOAL LABORAL TEMPORAL,030,9,1,24386.16,0,24386.16,23334.09,,,,,,,,,,
030,93100,13102,POLITICA ECONOMICA FISCAL. RET.COMPL.LABORAL TEMPORAL.,030,9,1,28620.36,0,28620.36,27365.62,,,,,,,,,,
030,93100,13500,POLÍTICA ECONÓMICA E FISCAL.PERSONAL LABORAL. PROMOC INTERNA,030,9,1,13943.55,0,13943.55,0,,,,,,,,,,
030,93100,16000,POLITICA ECONOMICA E FISCAL. SEGURIDAD SOCIAL.,030,9,1,461986.38,2910.18,464896.56,443572.76,,,,,,,,,,
030,93100,20200,POLÍTICA ECONÓMICA E FISCAL. ARRENDAMENTOS EDIFICIOS,030,9,2,49026.33,0,49026.33,48301.68,,,,,,,,,,
030,93100,20300,POLITICA ECONOM.E FISCAL ARRENDAMENTO MAQUIN.INSTALAC  UTILL,030,9,2,12000,0,12000,10329.85,,,,,,,,,,
030,93100,21600,POLITICA ECONO.E FISCAL REPAR. MANTEN. EQUIPOS PROC. INFORM.,030,9,2,750,0,750,76.79,,,,,,,,,,
030,93100,22000,ORDINARIO NO INVENTARIABLE.,030,9,2,3000,0,3000,0,,,,,,,,,,
030,93100,22001,POLITICA ECONÓMICA E FISCAL. LIBROS E OUTRAS PUBLICACIÓNS,030,9,2,16000,0,16000,17043.3,,,,,,,,,,
030,93100,22100,POLITICA ECONOMICA E FISCAL. ENERXÍA ELÉCTRICA.,030,9,2,3300,0,3300,2757.97,,,,,,,,,,
030,93100,22101,POLITICA ECONOMICA E FISCAL. AUGA,030,9,2,450,0,450,332.42,,,,,,,,,,
030,93100,22502,TRIBUTOS DE LAS ENTIDADES LOCALES.,030,9,2,0,0,0,2.01,,,,,,,,,,
030,93100,22602,POLITICA ECONOMICA E FISCAL.PUBLICIDADE E PROPAGANDA.,030,9,2,6000,3815.13,9815.13,30418.88,,,,,,,,,,
030,93100,22603,`POLITICA ECONOMICA E FISCAL.PUBLICACIÓN DIARIOS OFICIAIS,030,9,2,5000,0,5000,671.65,,,,,,,,,,
030,93100,22606,"POLITICA ECONOMICA E FISCAL. REUNIONS,CONFERENCIAS E CURSOS.",030,9,2,1000,0,1000,0,,,,,,,,,,
030,93100,22699,POLÍTICA ECONÓMICA E FISCAL. OUTROS GASTOS DIVERSOS,030,9,2,18940.9,0,18940.9,8958.66,,,,,,,,,,
030,93100,22701,POLITICA ECONOMICA E FISCAL. SEGURIDADE,030,9,2,1500,0,1500,1389.51,,,,,,,,,,
030,93100,22706,POLITICA ECONOMICA E FISCAL.ESTUDOS E TRABALLOS TÉCNICOS,030,9,2,500000,0,500000,86710.23,,,,,,,,,,
030,93100,22799,POLÍTICA ECONÓMICA E FISCAL.OUTROS TRAB REALIZ OUTRAS EMPRES,030,9,2,175000,20812,195812,119174.65,,,,,,,,,,
030,93100,23000,POLÍTICA ECONÓMICA E FISCAL. DIETAS CARGOS ELECTOS,030,9,2,1500,0,1500,571.66,,,,,,,,,,
030,93100,23020,POLÍTICA FISCAL E ECONÓMICA. AXUDAS DE CUSTE PERSOAL NON DIR,030,9,2,3510,0,3510,411.37,,,,,,,,,,
030,93100,23100,POLÍTICA ECONÓMICA E FISCAL. LOCOMOCIÓN CARGOS ELECTOS,030,9,2,1000,0,1000,2104.99,,,,,,,,,,
030,93100,23120,POLÍTICA FISCAL E ECONÓMICA.LOCOMOCIÓN PERSOAL NON DIRECTIVO,030,9,2,3510,120.46,3630.46,459.78,,,,,,,,,,
030,93200,22000,XESTIÓN SISTEMA TRIBUTARIO. MATERIAL OFICINA ORD. NON INVENT,030,9,2,8500,1281.24,9781.24,5943.01,,,,,,,,,,
030,93200,22699,XESTIÓN SISTEMA TRIBUTARIO. OUTROS GASTOS DIVERSOS,030,9,2,4000,1182.82,5182.82,2206.01,,,,,,,,,,
030,93200,22708,XESTION SISTEMA TRIBUTARIO. RECADACIÓN A FAVOR DA ENTIDADE,030,9,2,50000,0,50000,175365.67,,,,,,,,,,
030,93200,22799,XEST.SISTEMA TRIBUTARIO.ESTUDOS/TRAB TÉCNICOS.INSPECCIÓN ING,030,9,2,320000,0,320000,168351.6,,,,,,,,,,
030,93300,63200,XESTIÓN DO PATRIMONIO.INV. REPOSICION EDIFICIOS E CONSTRUCC.,030,9,6,150000,0,150000,0,,,,,,,,,,
030,93400,35901,OUTROS GASTOS FINANCEIROS,030,9,3,0,12410.16,12410.16,0,,,,,,,,,,
030,94300,46600,TRANSFERENCIAS A OUTRAS ENTIDADES QUE AGRUPEN CONCELLOS,030,9,4,100500,0,100500,97602.43,,,,,,,,,,
030,94300,46700,TRANSFERENCIAS CORRENTES A EELL. CONSORCIOS,030,9,4,1406216.74,0,1406216.74,1406216.74,,,,,,,,,,
040,33000,22609,ACTIVIDADES CULTURALES Y DEPORTIVAS,040,3,2,0,0,0,500,,,,,,,,,,
040,33000,22699,ADMON XERAL CULTURA. OUTROS GASTOS DIVERSOS,040,3,2,150000,11936,161936,157953.78,,,,,,,,,,
040,33000,22706,ESTUDIOS Y TRABAJOS TÉCNICOS.,040,3,2,0,0,0,13868.56,,,,,,,,,,
040,33000,23000,CULTURA. AXUDAS CUSTE DOS MEMBROS ÓRGANOS DE GOBERNO,040,3,2,0,0,0,702.97,,,,,,,,,,
040,33000,23100,CULTURA. LOCOMOCIÓN.DOS MEMBROS ÓRGANOS DO GOBERNO,040,3,2,0,0,0,1230.88,,,,,,,,,,
040,33000,41000,ADMON XERAL CULTURA. TRANSFERENCIAS O AUDITORIO DE GALICIA,040,3,4,1300000,0,1300000,1300000,,,,,,,,,,
040,33000,63200,INV. REPOSICION EDIFICIOS E CONSTRUCC.,040,3,6,0,31933.01,31933.01,0,,,,,,,,,,
040,33000,71000,A Organismos Autónomos de la Entidad Local,040,3,7,550000,0,550000,550000,,,,,,,,,,
040,33300,48902,MUSEOS E ARTES PLÁSTICAS. SUBV. NOMIN. FUNDACIÓN GRANELL,040,3,4,130000,0,130000,130000,,,,,,,,,,
040,33400,20300,PROMOCIÓN CULTURAL. ARRENDAMENTO MAQUIN. INSTALAC. E UTILL.,040,3,2,0,0,0,14318.42,,,,,,,,,,
040,33400,22602,PROMOCIÓN CULTURAL. PUBLICIDADE E PROPAGANDA.,040,3,2,0,0,0,16700.42,,,,,,,,,,
040,33400,22609,PROMOCIÓN CULTURAL. ACTIVIDADES CULTURAIS E DEPORTIVAS,040,3,2,0,0,0,18543.08,,,,,,,,,,
040,33400,22699,"PROMOCIÓN CULTURAL, OTROS GASTOS DIVERSOS",040,3,2,0,0,0,43742.52,,,,,,,,,,
040,33400,22706,PROMOCIÓN CULTURAL. ESTUDIOS E TRABALLOS TÉCNICOS,040,3,2,0,0,0,35937.83,,,,,,,,,,
040,33400,22799,PROMOC. CULTURAL. O. TRAB. REALIZ. POR O. EMPRESAS E PROFES.,040,3,2,0,0,0,6836.74,,,,,,,,,,
040,33400,47901,PROMOCIÓN CULTURAL. TRANSFERENCIAS A EMPRESAS PRIVADAS,040,3,4,100000,0,100000,0,,,,,,,,,,
040,33400,48900,PROMOCIÓN CULTURAL.TRANSF. NOMINATIVAS A FAMILIAS E ISFL,040,3,4,107600,0,107600,107508.92,,,,,,,,,,
040,33400,48901,PROMOCIÓN CULTURAL. TRANSF NON NOMINATIVAS A FAMILIAS E ISFL,040,3,4,50000,786.5,50786.5,1149.5,,,,,,,,,,
040,33401,21300,"BANDA DE MÚSICA. REPARAC. MANTEM, MAQUIN.,INSTA E UTILLA.",040,3,2,7000,0,7000,3288.29,,,,,,,,,,
040,33401,21600,BANDA DE MUSICA. REPARA. MANTEN. EQUIPOS PROCESOS INFORM.,040,3,2,3000,0,3000,1139.89,,,,,,,,,,
040,33401,22000,BANDA DE MÚSICA.MATERIAL OFICINA ORDINARIO NON INVENTARIABLE,040,3,2,11000,0,11000,5101.3,,,,,,,,,,
040,33401,22104,BANDA DE MUSICA. VESTIARIO.,040,3,2,18000,0,18000,14708.46,,,,,,,,,,
040,33401,22111,BANDA DE MÚSICA. MATERIAL FUNXIBLE.,040,3,2,7000,0,7000,2649.66,,,,,,,,,,
040,33401,22400,BANDA DE MÚSICA. PRIMAS DE SEGUROS,040,3,2,2000,0,2000,0,,,,,,,,,,
040,33401,22602,BANDA DE MÚSICA. PUBLICIDADE E PROPAGANDA,040,3,2,8500,0,8500,0,,,,,,,,,,
040,33401,22699,BANDA DE MUSICA. OUTROS GASTOS DIVERSOS,040,3,2,6000,0,6000,1161.51,,,,,,,,,,
040,33401,22799,BANDA DE MÚSICA. OUTROS TRABAJOS REALIZ POR OUTRAS EMPRESAS,040,3,2,28000,0,28000,29265.9,,,,,,,,,,
040,33401,62300,BANDA DE MÚSICA. INSTALACIONS E UTILLAXE,040,3,6,27000,0,27000,26994.27,,,,,,,,,,
040,33403,63200,INV. REPOSICION EDIFICIOS E CONSTRUCC.,040,3,6,0,1292.47,1292.47,0,,,,,,,,,,
040,33800,20300,FESTEXOS. ARRENDAMENTO MAQUIN. INSTALAC. E UTILLAXE,040,3,2,177000,525,177525,208281.13,,,,,,,,,,
040,33800,22400,FESTEXOS. PRIMAS DE SEGUROS,040,3,2,10000,0,10000,0,,,,,,,,,,
040,33800,22602,FESTEXOS. PUBLICIDADE E PROPAGANDA,040,3,2,1500,0,1500,22407.07,,,,,,,,,,
040,33800,22699,FESTEXOS. OUTROS GASTOS DIVERSOS. ACTIVIDADES,040,3,2,910000,49146.92,959146.92,696398.28,,,,,,,,,,
040,33800,22706,FESTEXOS. ESTUDOS E TRABALLOS TÉCNICOS,040,3,2,280000,62740.93,342740.93,400476.09,,,,,,,,,,
040,33800,48901,FESTEXOS.TRANSFERENCIAS NON NOMINATIVAS,040,3,4,48000,0,48000,37991.85,,,,,,,,,,
040,33800,62300,"FESTEXOS. MAQUINARIA, INSTALACIONS E UTILLAXE",040,3,6,50000,4356,54356,4356,,,,,,,,,,
040,33800,62500,FESTEXOS. MOBILIARIO,040,3,6,0,11238.77,11238.77,11238.77,,,,,,,,,,
040,93303,63200,INV. REPOSICION EDIFICIOS E CONSTRUCC.,040,9,6,0,48259.21,48259.21,45708.05,,,,,,,,,,
050,15000,21600,ADMON.XERAL VIVENDA E URBANIS. MANTEN EQUIPOS PROC INFO.,050,1,2,20000,0,20000,11520.9,,,,,,,,,,
050,15000,22000,ADMÓN XERAL VIVENDA E URBANISMO. MAT ORDINARIO NO INVENTAR.,050,1,2,5000,0,5000,0,,,,,,,,,,
050,15000,22603,ADMÓN XERAL VIVENDA E URBANISMO. PUBLICACIÓN EN DIARIOS OFIC,050,1,2,15000,0,15000,3949.32,,,,,,,,,,
050,15000,22699,ADMÓN. XERAL.VIVENDA E URBANISMO. OUTROS GASTOS DIVERSOS,050,1,2,69453.33,0,69453.33,22109.77,,,,,,,,,,
050,15100,21211,URBANISMO. REPARAC. MANTEN. E CONSERV EDIFICIOS E O. CONSTR.,050,1,2,7445,0,7445,0,,,,,,,,,,
050,15100,22411,URBANISMO. PRIMAS DE SEGUROS.,050,1,2,400,0,400,0,,,,,,,,,,
050,15100,22500,TRIBUTOS ESTATALES.,050,1,2,0,0,0,4689.28,,,,,,,,,,
050,15100,22603,URBANISMO. PUBLICACIÓN EN DIARIOS OFICIALES.,050,1,2,0,0,0,761.76,,,,,,,,,,
050,15100,22699,OTROS GASTOS DIVERSOS,050,1,2,0,143.49,143.49,937.86,,,,,,,,,,
050,15100,22706,URBANISMO. ESTUDOS E TRABALLOS TÉCNICOS,050,1,2,175000,0,175000,62551.75,,,,,,,,,,
